sp|Q5NL86|PLSX_ZYMMO Phosphate acyltransferase OS=Zymomonas mobilis subsp. mobilis (strain ATCC 31821 / ZM4 / CP4) OX=264203 GN=plsX PE=3 SV=1	sp|Q07MS2|PLSX_RHOP5 Phosphate acyltransferase OS=Rhodopseudomonas palustris (strain BisA53) OX=316055 GN=plsX PE=3 SV=1	0.46098650903546906
sp|A8GH95|CCME_SERP5 Cytochrome c-type biogenesis protein CcmE OS=Serratia proteamaculans (strain 568) OX=399741 GN=ccmE PE=3 SV=1	sp|A7FGJ2|CCME_YERP3 Cytochrome c-type biogenesis protein CcmE OS=Yersinia pseudotuberculosis serotype O:1b (strain IP 31758) OX=349747 GN=ccmE PE=3 SV=1	0.8457078851472172
sp|P61520|ASSY_BACC1 Argininosuccinate synthase OS=Bacillus cereus (strain ATCC 10987 / NRS 248) OX=222523 GN=argG PE=3 SV=1	sp|A9VKE1|ASSY_BACMK Argininosuccinate synthase OS=Bacillus mycoides (strain KBAB4) OX=315730 GN=argG PE=3 SV=1	0.9888167189455349
sp|Q02T90|RL1_PSEAB Large ribosomal subunit protein uL1 OS=Pseudomonas aeruginosa (strain UCBPP-PA14) OX=208963 GN=rplA PE=3 SV=1	sp|A6UZH8|RL1_PSEA7 Large ribosomal subunit protein uL1 OS=Pseudomonas aeruginosa (strain PA7) OX=381754 GN=rplA PE=3 SV=1	1.0
sp|Q9FY19|PGLR2_JUNAS Polygalacturonase OS=Juniperus ashei OX=13101 GN=JNA2 PE=1 SV=1	sp|O96910|ATT_APLCA Attractin OS=Aplysia californica OX=6500 GN=ATT PE=1 SV=1	0.17974072576176894
sp|P43014|SYT_HAEIN Threonine--tRNA ligase OS=Haemophilus influenzae (strain ATCC 51907 / DSM 11121 / KW20 / Rd) OX=71421 GN=thrS PE=3 SV=1	sp|B0BSM2|SYT_ACTPJ Threonine--tRNA ligase OS=Actinobacillus pleuropneumoniae serotype 3 (strain JL03) OX=434271 GN=thrS PE=3 SV=1	0.933513987937684
sp|P37111|ACY1_PIG Aminoacylase-1 OS=Sus scrofa OX=9823 GN=ACY1 PE=1 SV=2	sp|O67431|Y1444_AQUAE Protein aq_1444 OS=Aquifex aeolicus (strain VF5) OX=224324 GN=aq_1444 PE=3 SV=1	0.20465176042980068
sp|Q8N350|CBARP_HUMAN Voltage-dependent calcium channel beta subunit-associated regulatory protein OS=Homo sapiens OX=9606 GN=CBARP PE=1 SV=3	sp|O59284|WECC_PYRHO UDP-N-acetyl-D-mannosamine dehydrogenase OS=Pyrococcus horikoshii (strain ATCC 700860 / DSM 12428 / JCM 9974 / NBRC 100139 / OT-3) OX=70601 GN=PH1618 PE=1 SV=1	0.1493670914851554
sp|A9R1H8|Y1027_YERPG UPF0231 protein YpAngola_A1027 OS=Yersinia pestis bv. Antiqua (strain Angola) OX=349746 GN=YpAngola_A1027 PE=3 SV=1	sp|Q1CLX4|Y674_YERPN UPF0231 protein YPN_0674 OS=Yersinia pestis bv. Antiqua (strain Nepal516) OX=377628 GN=YPN_0674 PE=3 SV=1	1.0
sp|A0R8L3|RS9_BACAH Small ribosomal subunit protein uS9 OS=Bacillus thuringiensis (strain Al Hakam) OX=412694 GN=rpsI PE=3 SV=1	sp|Q73F62|RS9_BACC1 Small ribosomal subunit protein uS9 OS=Bacillus cereus (strain ATCC 10987 / NRS 248) OX=222523 GN=rpsI PE=3 SV=1	1.0
sp|P03039|TETR3_ECOLX Tetracycline repressor protein class C OS=Escherichia coli OX=562 GN=tetR PE=4 SV=1	sp|P51560|TETR7_VIBAN Tetracycline repressor protein class G OS=Vibrio anguillarum OX=55601 GN=tetR PE=2 SV=1	0.468113880030103
sp|Q82LR8|FLUC3_STRAW Fluoride-specific ion channel FluC 3 OS=Streptomyces avermitilis (strain ATCC 31267 / DSM 46492 / JCM 5070 / NBRC 14893 / NCIMB 12804 / NRRL 8165 / MA-4680) OX=227882 GN=fluC3 PE=3 SV=1	sp|B7L9G9|FLUC_ECO55 Fluoride-specific ion channel FluC OS=Escherichia coli (strain 55989 / EAEC) OX=585055 GN=fluC PE=3 SV=1	0.33228584083872575
sp|B7LRQ3|DEF_ESCF3 Peptide deformylase OS=Escherichia fergusonii (strain ATCC 35469 / DSM 13698 / CCUG 18766 / IAM 14443 / JCM 21226 / LMG 7866 / NBRC 102419 / NCTC 12128 / CDC 0568-73) OX=585054 GN=def PE=3 SV=1	sp|B7NLK6|DEF_ECO7I Peptide deformylase OS=Escherichia coli O7:K1 (strain IAI39 / ExPEC) OX=585057 GN=def PE=3 SV=1	0.9965619699944849
sp|Q8WKN0|MATK_ACEPM Maturase K OS=Acer palmatum OX=66201 GN=matK PE=3 SV=1	sp|Q3T8Q6|MATK_MAGCH Maturase K OS=Magnolia champaca OX=86757 GN=matK PE=3 SV=1	0.5639540987977624
sp|Q88ZA0|NPD_LACPL NAD-dependent protein deacetylase OS=Lactiplantibacillus plantarum (strain ATCC BAA-793 / NCIMB 8826 / WCFS1) OX=220668 GN=cobB PE=3 SV=1	sp|Q927A7|NPD_LISIN NAD-dependent protein deacetylase OS=Listeria innocua serovar 6a (strain ATCC BAA-680 / CLIP 11262) OX=272626 GN=cobB PE=3 SV=1	0.5895587109070243
sp|P0AC26|NIRC_ECOLI Nitrite transporter NirC OS=Escherichia coli (strain K12) OX=83333 GN=nirC PE=1 SV=1	sp|B4TVE9|MDTI_SALSV Spermidine export protein MdtI OS=Salmonella schwarzengrund (strain CVM19633) OX=439843 GN=mdtI PE=3 SV=1	0.22604286230973675
sp|Q7VQH5|ERPA_BLOFL Iron-sulfur cluster insertion protein ErpA OS=Blochmanniella floridana OX=203907 GN=erpA PE=3 SV=1	sp|Q493N7|ERPA_BLOPB Iron-sulfur cluster insertion protein ErpA OS=Blochmanniella pennsylvanica (strain BPEN) OX=291272 GN=erpA PE=3 SV=1	0.7465223435703389
sp|P02929|TONB_ECOLI Protein TonB OS=Escherichia coli (strain K12) OX=83333 GN=tonB PE=1 SV=2	sp|Q5MJ08|SPXN4_HUMAN Sperm protein associated with the nucleus on the X chromosome N4 OS=Homo sapiens OX=9606 GN=SPANXN4 PE=1 SV=1	0.22483277329463747
sp|Q8BPP5|LYPD6_MOUSE Ly6/PLAUR domain-containing protein 6 OS=Mus musculus OX=10090 GN=Lypd6 PE=1 SV=1	sp|Q9D7F2|LPD6B_MOUSE Ly6/PLAUR domain-containing protein 6B OS=Mus musculus OX=10090 GN=Lypd6b PE=2 SV=2	0.4250179029700225
sp|P0C121|URE31_BRUAB Urease subunit gamma 1 OS=Brucella abortus biovar 1 (strain 9-941) OX=262698 GN=ureA1 PE=3 SV=1	sp|A6UC40|URE3_SINMW Urease subunit gamma OS=Sinorhizobium medicae (strain WSM419) OX=366394 GN=ureA PE=3 SV=1	0.975287642022679
sp|Q03265|ATPA_MOUSE ATP synthase subunit alpha, mitochondrial OS=Mus musculus OX=10090 GN=Atp5f1a PE=1 SV=1	sp|P19483|ATPA_BOVIN ATP synthase subunit alpha, mitochondrial OS=Bos taurus OX=9913 GN=ATP5F1A PE=1 SV=1	0.9799293368360129
sp|A5U6Z2|DDL_MYCTA D-alanine--D-alanine ligase OS=Mycobacterium tuberculosis (strain ATCC 25177 / H37Ra) OX=419947 GN=ddl PE=3 SV=1	sp|Q9ZGN0|DDL_MYCSM D-alanine--D-alanine ligase OS=Mycolicibacterium smegmatis OX=1772 GN=ddl PE=3 SV=1	0.832530548606247
sp|Q9KP83|LEU1_VIBCH 2-isopropylmalate synthase OS=Vibrio cholerae serotype O1 (strain ATCC 39315 / El Tor Inaba N16961) OX=243277 GN=leuA PE=3 SV=1	sp|Q7MP77|LEU1_VIBVY 2-isopropylmalate synthase OS=Vibrio vulnificus (strain YJ016) OX=196600 GN=leuA PE=3 SV=1	0.9472522784378035
sp|Q91VK1|5MP1_MOUSE eIF5-mimic protein 1 OS=Mus musculus OX=10090 GN=Bzw2 PE=1 SV=1	sp|Q2L4X1|5MP1_MUSMM eIF5-mimic protein 1 OS=Mus musculus molossinus OX=57486 GN=Bzw2 PE=2 SV=1	1.0
sp|Q5X2Z8|LOLD_LEGPA Lipoprotein-releasing system ATP-binding protein LolD OS=Legionella pneumophila (strain Paris) OX=297246 GN=lolD PE=3 SV=1	sp|Q604C1|LOLD_METCA Lipoprotein-releasing system ATP-binding protein LolD OS=Methylococcus capsulatus (strain ATCC 33009 / NCIMB 11132 / Bath) OX=243233 GN=lolD PE=3 SV=1	0.6640971556932379
sp|B3EGV0|GLGA_CHLL2 Glycogen synthase OS=Chlorobium limicola (strain DSM 245 / NBRC 103803 / 6330) OX=290315 GN=glgA PE=3 SV=1	sp|B3EGV0|GLGA_CHLL2 Glycogen synthase OS=Chlorobium limicola (strain DSM 245 / NBRC 103803 / 6330) OX=290315 GN=glgA PE=3 SV=1	1.0
sp|Q7NLS3|Y1048_GLOVI UPF0145 protein gll1048 OS=Gloeobacter violaceus (strain ATCC 29082 / PCC 7421) OX=251221 GN=gll1048 PE=3 SV=1	sp|Q10Y33|Y3795_TRIEI UPF0145 protein Tery_3795 OS=Trichodesmium erythraeum (strain IMS101) OX=203124 GN=Tery_3795 PE=3 SV=1	0.6906562791837719
sp|P9WQ73|SERC_MYCTU Phosphoserine aminotransferase OS=Mycobacterium tuberculosis (strain ATCC 25618 / H37Rv) OX=83332 GN=serC PE=1 SV=1	sp|P13471|RS14_RAT Small ribosomal subunit protein uS11 OS=Rattus norvegicus OX=10116 GN=Rps14 PE=1 SV=3	0.1929771988644769
sp|Q4WEP0|SFH5_ASPFU Phosphatidylinositol transfer protein sfh5 OS=Aspergillus fumigatus (strain ATCC MYA-4609 / CBS 101355 / FGSC A1100 / Af293) OX=330879 GN=sfh5 PE=3 SV=1	sp|Q5YQ92|EX7L_NOCFA Exodeoxyribonuclease 7 large subunit OS=Nocardia farcinica (strain IFM 10152) OX=247156 GN=xseA PE=3 SV=1	0.18454246090352303
sp|A8ZXW5|MURD_DESOH UDP-N-acetylmuramoylalanine--D-glutamate ligase OS=Desulfosudis oleivorans (strain DSM 6200 / JCM 39069 / Hxd3) OX=96561 GN=murD PE=3 SV=1	sp|B8FT58|MURD_DESHD UDP-N-acetylmuramoylalanine--D-glutamate ligase OS=Desulfitobacterium hafniense (strain DSM 10664 / DCB-2) OX=272564 GN=murD PE=3 SV=1	0.28772294911610774
sp|Q5ZM98|GRP75_CHICK Stress-70 protein, mitochondrial OS=Gallus gallus OX=9031 GN=HSPA9 PE=1 SV=1	sp|Q5R511|GRP75_PONAB Stress-70 protein, mitochondrial OS=Pongo abelii OX=9601 GN=HSPA9 PE=2 SV=1	0.8434739469524963
sp|P80580|MHBI_KLEPN Maleylpyruvate isomerase (Fragment) OS=Klebsiella pneumoniae OX=573 GN=mhbI PE=1 SV=1	sp|P19918|DCMS_PSECH Carbon monoxide dehydrogenase small chain (Fragment) OS=Pseudomonas carboxydohydrogena OX=290 GN=cutS PE=1 SV=1	0.6093586699340393
sp|Q81WI8|RNC_BACAN Ribonuclease 3 OS=Bacillus anthracis OX=1392 GN=rnc PE=3 SV=1	sp|C3L778|RNC_BACAC Ribonuclease 3 OS=Bacillus anthracis (strain CDC 684 / NRRL 3495) OX=568206 GN=rnc PE=3 SV=1	1.0
sp|O31820|YNEN_BACSU Thioredoxin-like protein YneN OS=Bacillus subtilis (strain 168) OX=224308 GN=yneN PE=3 SV=1	sp|A4IQF5|RESA_GEOTN Thiol-disulfide oxidoreductase ResA OS=Geobacillus thermodenitrificans (strain NG80-2) OX=420246 GN=resA PE=3 SV=1	0.32326041610282163
sp|Q38WR4|RS15_LATSS Small ribosomal subunit protein uS15 OS=Latilactobacillus sakei subsp. sakei (strain 23K) OX=314315 GN=rpsO PE=3 SV=1	sp|Q1WU87|RS15_LIGS1 Small ribosomal subunit protein uS15 OS=Ligilactobacillus salivarius (strain UCC118) OX=362948 GN=rpsO PE=3 SV=1	0.7935862619929266
sp|C1CFN5|SEPF_STRZJ Cell division protein SepF OS=Streptococcus pneumoniae (strain JJA) OX=488222 GN=sepF PE=3 SV=1	sp|Q8DNW1|SEPF_STRR6 Cell division protein SepF OS=Streptococcus pneumoniae (strain ATCC BAA-255 / R6) OX=171101 GN=sepF PE=3 SV=1	0.9912423100098386
sp|Q2YAD6|POTA_NITMU Spermidine/putrescine import ATP-binding protein PotA OS=Nitrosospira multiformis (strain ATCC 25196 / NCIMB 11849 / C 71) OX=323848 GN=potA PE=3 SV=1	sp|Q5E586|POTA_ALIF1 Spermidine/putrescine import ATP-binding protein PotA OS=Aliivibrio fischeri (strain ATCC 700601 / ES114) OX=312309 GN=potA PE=3 SV=1	0.46229947821833695
sp|Q65GM5|RL27_BACLD Large ribosomal subunit protein bL27 OS=Bacillus licheniformis (strain ATCC 14580 / DSM 13 / JCM 2505 / CCUG 7422 / NBRC 12200 / NCIMB 9375 / NCTC 10341 / NRRL NRS-1264 / Gibson 46) OX=279010 GN=rpmA PE=3 SV=1	sp|Q65GM5|RL27_BACLD Large ribosomal subunit protein bL27 OS=Bacillus licheniformis (strain ATCC 14580 / DSM 13 / JCM 2505 / CCUG 7422 / NBRC 12200 / NCIMB 9375 / NCTC 10341 / NRRL NRS-1264 / Gibson 46) OX=279010 GN=rpmA PE=3 SV=1	1.0
sp|P59063|RR7_CHAGL Small ribosomal subunit protein uS7c OS=Chaetosphaeridium globosum OX=96477 GN=rps7 PE=3 SV=1	sp|Q8W8V0|RR7_PSINU Small ribosomal subunit protein uS7cz/uS7cy OS=Psilotum nudum OX=3240 GN=rps7-A PE=3 SV=1	0.7967158012191078
sp|B0SZC3|NQOR_CAUSK NAD(P)H dehydrogenase (quinone) OS=Caulobacter sp. (strain K31) OX=366602 GN=Caul_4332 PE=3 SV=1	sp|Q1LFW3|NQOR_CUPMC NAD(P)H dehydrogenase (quinone) OS=Cupriavidus metallidurans (strain ATCC 43123 / DSM 2839 / NBRC 102507 / CH34) OX=266264 GN=Rmet_4096 PE=3 SV=1	0.8815948661100821
sp|A3PFE1|DAPA_PROM0 4-hydroxy-tetrahydrodipicolinate synthase OS=Prochlorococcus marinus (strain MIT 9301) OX=167546 GN=dapA PE=3 SV=1	sp|Q7UA33|DAPA_PARMW 4-hydroxy-tetrahydrodipicolinate synthase OS=Parasynechococcus marenigrum (strain WH8102) OX=84588 GN=dapA PE=3 SV=1	0.6801100632605984
sp|Q9HGN6|DUS1_SCHPO tRNA-dihydrouridine(16/17) synthase [NAD(P)(+)] OS=Schizosaccharomyces pombe (strain 972 / ATCC 24843) OX=284812 GN=dus1 PE=1 SV=1	sp|Q8K582|DUS1L_RAT tRNA-dihydrouridine(16/17) synthase [NAD(P)(+)]-like OS=Rattus norvegicus OX=10116 GN=Dus1l PE=2 SV=1	0.2924139761060909
sp|P17101|HBSAG_HBVA4 Large envelope protein OS=Hepatitis B virus genotype A2 subtype adw2 (isolate Germany/991/1990) OX=10410 GN=S PE=1 SV=3	sp|Q4R1S6|HBSAG_HBVA8 Large envelope protein OS=Hepatitis B virus genotype A3 (isolate Cameroon/CMR983/1994) OX=489458 GN=S PE=1 SV=1	0.9236724033875996
sp|Q5LZE0|EX7S_STRT1 Exodeoxyribonuclease 7 small subunit OS=Streptococcus thermophilus (strain CNRZ 1066) OX=299768 GN=xseB PE=3 SV=1	sp|Q5M3Z2|EX7S_STRT2 Exodeoxyribonuclease 7 small subunit OS=Streptococcus thermophilus (strain ATCC BAA-250 / LMG 18311) OX=264199 GN=xseB PE=3 SV=1	1.0
sp|A7Y3A4|ATPA_IPOPU ATP synthase subunit alpha, chloroplastic OS=Ipomoea purpurea OX=4121 GN=atpA PE=3 SV=1	sp|Q2MIB5|ATPA_SOLLC ATP synthase subunit alpha, chloroplastic OS=Solanum lycopersicum OX=4081 GN=atpA PE=3 SV=1	0.948656372611175
sp|Q0CZR3|PTF_ASPTN Aromatic prenyltransferase OS=Aspergillus terreus (strain NIH 2624 / FGSC A1156) OX=341663 GN=ptf PE=1 SV=1	sp|Q8GHB2|CLOQ_STRRC 4-hydroxyphenylpyruvate 3-dimethylallyltransferase OS=Streptomyces roseochromogenus subsp. oscitans OX=149682 GN=cloQ PE=1 SV=1	0.312273488055064
sp|B4T3F3|RS18_SALNS Small ribosomal subunit protein bS18 OS=Salmonella newport (strain SL254) OX=423368 GN=rpsR PE=3 SV=1	sp|Q0SX84|RS18_SHIF8 Small ribosomal subunit protein bS18 OS=Shigella flexneri serotype 5b (strain 8401) OX=373384 GN=rpsR PE=3 SV=1	1.0
sp|Q0VC85|PHLA2_BOVIN Pleckstrin homology-like domain family A member 2 OS=Bos taurus OX=9913 GN=PHLDA2 PE=2 SV=1	sp|P0DPR8|FARR_NEIGO HTH-type transcriptional regulator FarR OS=Neisseria gonorrhoeae OX=485 GN=farR PE=1 SV=1	0.27442722375130935
sp|Q5LNP1|ATPB_RUEPO ATP synthase subunit beta OS=Ruegeria pomeroyi (strain ATCC 700808 / DSM 15171 / DSS-3) OX=246200 GN=atpD PE=3 SV=1	sp|Q3J431|ATPB1_CERS4 ATP synthase subunit beta 1 OS=Cereibacter sphaeroides (strain ATCC 17023 / DSM 158 / JCM 6121 / CCUG 31486 / LMG 2827 / NBRC 12203 / NCIMB 8253 / ATH 2.4.1.) OX=272943 GN=atpD1 PE=3 SV=1	0.9150979279383633
sp|Q02T63|RS5_PSEAB Small ribosomal subunit protein uS5 OS=Pseudomonas aeruginosa (strain UCBPP-PA14) OX=208963 GN=rpsE PE=3 SV=1	sp|C1DKN0|RS5_AZOVD Small ribosomal subunit protein uS5 OS=Azotobacter vinelandii (strain DJ / ATCC BAA-1303) OX=322710 GN=rpsE PE=3 SV=1	0.9702240579970862
sp|O27336|HJC_METTH Crossover junction endodeoxyribonuclease Hjc OS=Methanothermobacter thermautotrophicus (strain ATCC 29096 / DSM 1053 / JCM 10044 / NBRC 100330 / Delta H) OX=187420 GN=hjc PE=1 SV=1	sp|Q97YX6|HJE_SACS2 Crossover junction endodeoxyribonuclease Hje OS=Saccharolobus solfataricus (strain ATCC 35092 / DSM 1617 / JCM 11322 / P2) OX=273057 GN=hje PE=1 SV=1	0.3192991703622671
sp|P68527|ATP6_WHEAT ATP synthase subunit a OS=Triticum aestivum OX=4565 GN=ATP6 PE=3 SV=1	sp|P05500|ATP6_OENBE ATP synthase subunit a OS=Oenothera berteroana OX=3950 GN=ATP6 PE=2 SV=2	0.48820958722506713
sp|Q46BD6|ASPD_METBF L-aspartate dehydrogenase OS=Methanosarcina barkeri (strain Fusaro / DSM 804) OX=269797 GN=nadX PE=3 SV=1	sp|Q46BD6|ASPD_METBF L-aspartate dehydrogenase OS=Methanosarcina barkeri (strain Fusaro / DSM 804) OX=269797 GN=nadX PE=3 SV=1	1.0
sp|A5F643|PUR5_VIBC3 Phosphoribosylformylglycinamidine cyclo-ligase OS=Vibrio cholerae serotype O1 (strain ATCC 39541 / Classical Ogawa 395 / O395) OX=345073 GN=purM PE=3 SV=1	sp|A5F643|PUR5_VIBC3 Phosphoribosylformylglycinamidine cyclo-ligase OS=Vibrio cholerae serotype O1 (strain ATCC 39541 / Classical Ogawa 395 / O395) OX=345073 GN=purM PE=3 SV=1	1.0
sp|Q6XTD9|NEP_I67A0 Nuclear export protein OS=Influenza A virus (strain A/Tokyo/3/1967 H2N2) OX=380960 GN=NS PE=3 SV=1	sp|Q6XTD9|NEP_I67A0 Nuclear export protein OS=Influenza A virus (strain A/Tokyo/3/1967 H2N2) OX=380960 GN=NS PE=3 SV=1	1.0
sp|Q2NA74|NUOI_ERYLH NADH-quinone oxidoreductase subunit I OS=Erythrobacter litoralis (strain HTCC2594) OX=314225 GN=nuoI PE=3 SV=1	sp|Q2NA74|NUOI_ERYLH NADH-quinone oxidoreductase subunit I OS=Erythrobacter litoralis (strain HTCC2594) OX=314225 GN=nuoI PE=3 SV=1	1.0
sp|Q5RFV8|WDCP_DANRE WD repeat and coiled-coil-containing protein OS=Danio rerio OX=7955 GN=wdcp PE=2 SV=2	sp|Q5ZKI7|WDCP_CHICK WD repeat and coiled-coil-containing protein OS=Gallus gallus OX=9031 GN=WDCP PE=2 SV=1	0.1869281172486655
sp|Q2IM25|THIE_ANADE Thiamine-phosphate synthase OS=Anaeromyxobacter dehalogenans (strain 2CP-C) OX=290397 GN=thiE PE=3 SV=1	sp|Q8PS49|THIE_METMA Thiamine-phosphate synthase OS=Methanosarcina mazei (strain ATCC BAA-159 / DSM 3647 / Goe1 / Go1 / JCM 11833 / OCM 88) OX=192952 GN=thiE PE=3 SV=1	0.3332623352993996
sp|Q7VL86|PDXS_HAEDU Pyridoxal 5'-phosphate synthase subunit PdxS OS=Haemophilus ducreyi (strain 35000HP / ATCC 700724) OX=233412 GN=pdxS PE=3 SV=1	sp|B3GXB6|PDXS_ACTP7 Pyridoxal 5'-phosphate synthase subunit PdxS OS=Actinobacillus pleuropneumoniae serotype 7 (strain AP76) OX=537457 GN=pdxS PE=3 SV=1	0.914087545937193
sp|Q68VN9|DAPE_RICTY Succinyl-diaminopimelate desuccinylase OS=Rickettsia typhi (strain ATCC VR-144 / Wilmington) OX=257363 GN=dapE PE=3 SV=1	sp|Q4UJR2|DAPE_RICFE Succinyl-diaminopimelate desuccinylase OS=Rickettsia felis (strain ATCC VR-1525 / URRWXCal2) OX=315456 GN=dapE PE=3 SV=1	0.6216456631120865
sp|B5FN39|ATP6_SALDC ATP synthase subunit a OS=Salmonella dublin (strain CT_02021853) OX=439851 GN=atpB PE=3 SV=1	sp|B5QVD8|ATP6_SALEP ATP synthase subunit a OS=Salmonella enteritidis PT4 (strain P125109) OX=550537 GN=atpB PE=3 SV=1	1.0
sp|P0ADW5|ZAPG_ECO57 Z-ring associated protein G OS=Escherichia coli O157:H7 OX=83334 GN=zapG PE=3 SV=2	sp|Q8XV86|HIS3_RALN1 Phosphoribosyl-AMP cyclohydrolase OS=Ralstonia nicotianae (strain ATCC BAA-1114 / GMI1000) OX=267608 GN=hisI PE=3 SV=1	0.314454981254966
sp|B1XHF9|OBG_ECODH GTPase Obg OS=Escherichia coli (strain K12 / DH10B) OX=316385 GN=obg PE=3 SV=1	sp|B7LHP6|OBG_ECO55 GTPase Obg OS=Escherichia coli (strain 55989 / EAEC) OX=585055 GN=obg PE=3 SV=1	0.9989867210448794
sp|Q5R4T2|BMAL1_PONAB Basic helix-loop-helix ARNT-like protein 1 OS=Pongo abelii OX=9601 GN=BMAL1 PE=2 SV=1	sp|Q9WTL8|BMAL1_MOUSE Basic helix-loop-helix ARNT-like protein 1 OS=Mus musculus OX=10090 GN=Bmal1 PE=1 SV=2	0.8545320143094208
sp|Q5ZHN5|THAP5_CHICK THAP domain-containing protein 5 OS=Gallus gallus OX=9031 GN=THAP5 PE=2 SV=1	sp|Q0IHI7|THAP5_XENLA THAP domain-containing protein 5 OS=Xenopus laevis OX=8355 GN=thap5 PE=2 SV=1	0.1939479720361532
sp|Q5J6J3|DPP4_TRIRU Dipeptidyl peptidase 4 OS=Trichophyton rubrum OX=5551 GN=DPP4 PE=1 SV=1	sp|B6V868|DPP4_TRITO Dipeptidyl peptidase 4 OS=Trichophyton tonsurans OX=34387 GN=DPP4 PE=3 SV=1	0.979319659322208
sp|Q6KI76|ATPL_MYCM1 ATP synthase subunit c OS=Mycoplasma mobile (strain ATCC 43663 / 163K / NCTC 11711) OX=267748 GN=atpE PE=3 SV=1	sp|P33258|ATPL_MYCGA ATP synthase subunit c OS=Mycoplasmoides gallisepticum (strain R(low / passage 15 / clone 2)) OX=710127 GN=atpE PE=3 SV=2	0.4439482269195685
sp|P65916|PYRE_STAAM Orotate phosphoribosyltransferase OS=Staphylococcus aureus (strain Mu50 / ATCC 700699) OX=158878 GN=pyrE PE=3 SV=1	sp|A8AXM7|PYRE_STRGC Orotate phosphoribosyltransferase OS=Streptococcus gordonii (strain Challis / ATCC 35105 / BCRC 15272 / CH1 / DL1 / V288) OX=467705 GN=pyrE PE=3 SV=1	0.6454815780628507
sp|Q09FX3|ATPI_NANDO ATP synthase subunit a, chloroplastic OS=Nandina domestica OX=41776 GN=atpI PE=3 SV=1	sp|Q09FX3|ATPI_NANDO ATP synthase subunit a, chloroplastic OS=Nandina domestica OX=41776 GN=atpI PE=3 SV=1	1.0
sp|A1S1G8|RL34_SHEAM Large ribosomal subunit protein bL34 OS=Shewanella amazonensis (strain ATCC BAA-1098 / SB2B) OX=326297 GN=rpmH PE=3 SV=1	sp|A1S1G8|RL34_SHEAM Large ribosomal subunit protein bL34 OS=Shewanella amazonensis (strain ATCC BAA-1098 / SB2B) OX=326297 GN=rpmH PE=3 SV=1	1.0
sp|Q5FIX8|TMCAL_LACAC tRNA(Met) cytidine acetate ligase OS=Lactobacillus acidophilus (strain ATCC 700396 / NCK56 / N2 / NCFM) OX=272621 GN=tmcAL PE=3 SV=1	sp|Q041W0|TMCAL_LACGA tRNA(Met) cytidine acetate ligase OS=Lactobacillus gasseri (strain ATCC 33323 / DSM 20243 / BCRC 14619 / CIP 102991 / JCM 1131 / KCTC 3163 / NCIMB 11718 / NCTC 13722 / AM63) OX=324831 GN=tmcAL PE=3 SV=1	0.42462836262050124
sp|Q8ENI4|FLIT_OCEIH Flagellar protein FliT OS=Oceanobacillus iheyensis (strain DSM 14371 / CIP 107618 / JCM 11309 / KCTC 3954 / HTE831) OX=221109 GN=fliT PE=3 SV=1	sp|A4ISU3|FLIT_GEOTN Flagellar protein FliT OS=Geobacillus thermodenitrificans (strain NG80-2) OX=420246 GN=fliT PE=3 SV=1	0.5517744690607806
sp|Q9D0U6|MAF1_MOUSE Repressor of RNA polymerase III transcription MAF1 homolog OS=Mus musculus OX=10090 GN=Maf1 PE=2 SV=1	sp|Q5XIH0|MAF1_RAT Repressor of RNA polymerase III transcription MAF1 homolog OS=Rattus norvegicus OX=10116 GN=Maf1 PE=2 SV=1	0.8660572189181143
sp|Q6CE38|CLU_YARLI Clustered mitochondria protein homolog OS=Yarrowia lipolytica (strain CLIB 122 / E 150) OX=284591 GN=CLU1 PE=3 SV=1	sp|Q9RHX2|PUR7_CORAM Phosphoribosylaminoimidazole-succinocarboxamide synthase OS=Corynebacterium ammoniagenes OX=1697 GN=purC PE=3 SV=1	0.11788053606596051
sp|A9VST4|Y454_BACMK UPF0295 protein BcerKBAB4_0454 OS=Bacillus mycoides (strain KBAB4) OX=315730 GN=BcerKBAB4_0454 PE=3 SV=1	sp|C1EWH3|Y557_BACC3 UPF0295 protein BCA_0557 OS=Bacillus cereus (strain 03BB102) OX=572264 GN=BCA_0557 PE=3 SV=1	0.9880749567866293
sp|A8AXC2|TYSY_STRGC Thymidylate synthase OS=Streptococcus gordonii (strain Challis / ATCC 35105 / BCRC 15272 / CH1 / DL1 / V288) OX=467705 GN=thyA PE=3 SV=1	sp|Q04LL8|TYSY_STRP2 Thymidylate synthase OS=Streptococcus pneumoniae serotype 2 (strain D39 / NCTC 7466) OX=373153 GN=thyA PE=3 SV=1	0.9643248031387269
sp|P48264|PSB28_CYAPA Photosystem II reaction center Psb28 protein OS=Cyanophora paradoxa OX=2762 GN=psb28 PE=3 SV=1	sp|Q31ML0|PSB28_SYNE7 Photosystem II reaction center Psb28 protein OS=Synechococcus elongatus (strain ATCC 33912 / PCC 7942 / FACHB-805) OX=1140 GN=psb28 PE=3 SV=1	0.4074033797433608
sp|P0AC30|FTSX_ECOLI Cell division protein FtsX OS=Escherichia coli (strain K12) OX=83333 GN=ftsX PE=1 SV=1	sp|F5HCJ2|VCCL3_HHV8P Protein vCCL3 OS=Human herpesvirus 8 type P (isolate GK18) OX=868565 GN=K4.1 PE=3 SV=1	0.20512563817858534
sp|O75127|PTCD1_HUMAN Pentatricopeptide repeat-containing protein 1, mitochondrial OS=Homo sapiens OX=9606 GN=PTCD1 PE=1 SV=2	sp|O75127|PTCD1_HUMAN Pentatricopeptide repeat-containing protein 1, mitochondrial OS=Homo sapiens OX=9606 GN=PTCD1 PE=1 SV=2	1.0
sp|Q3J555|PYRE_CERS4 Orotate phosphoribosyltransferase OS=Cereibacter sphaeroides (strain ATCC 17023 / DSM 158 / JCM 6121 / CCUG 31486 / LMG 2827 / NBRC 12203 / NCIMB 8253 / ATH 2.4.1.) OX=272943 GN=pyrE PE=3 SV=1	sp|A3PH80|PYRE_CERS1 Orotate phosphoribosyltransferase OS=Cereibacter sphaeroides (strain ATCC 17029 / ATH 2.4.9) OX=349101 GN=pyrE PE=3 SV=1	0.9991718653245928
sp|Q032X5|ARLY_LACLS Argininosuccinate lyase OS=Lactococcus lactis subsp. cremoris (strain SK11) OX=272622 GN=argH PE=3 SV=1	sp|Q032X5|ARLY_LACLS Argininosuccinate lyase OS=Lactococcus lactis subsp. cremoris (strain SK11) OX=272622 GN=argH PE=3 SV=1	1.0
sp|P36279|REP_TLCVA Replication-associated protein OS=Tomato leaf curl virus (strain Australia) OX=223353 GN=C1 PE=1 SV=1	sp|P36279|REP_TLCVA Replication-associated protein OS=Tomato leaf curl virus (strain Australia) OX=223353 GN=C1 PE=1 SV=1	1.0
sp|Q9ZWC8|BRL1_ARATH Serine/threonine-protein kinase BRI1-like 1 OS=Arabidopsis thaliana OX=3702 GN=BRL1 PE=1 SV=1	sp|Q9ZWC8|BRL1_ARATH Serine/threonine-protein kinase BRI1-like 1 OS=Arabidopsis thaliana OX=3702 GN=BRL1 PE=1 SV=1	1.0
sp|Q8KEG7|METK_CHLTE S-adenosylmethionine synthase OS=Chlorobaculum tepidum (strain ATCC 49652 / DSM 12025 / NBRC 103806 / TLS) OX=194439 GN=metK PE=3 SV=2	sp|Q8KEG7|METK_CHLTE S-adenosylmethionine synthase OS=Chlorobaculum tepidum (strain ATCC 49652 / DSM 12025 / NBRC 103806 / TLS) OX=194439 GN=metK PE=3 SV=2	1.0
sp|Q73H91|RL22_WOLPM Large ribosomal subunit protein uL22 OS=Wolbachia pipientis wMel OX=163164 GN=rplV PE=3 SV=1	sp|A8ZV62|RL22_DESOH Large ribosomal subunit protein uL22 OS=Desulfosudis oleivorans (strain DSM 6200 / JCM 39069 / Hxd3) OX=96561 GN=rplV PE=3 SV=1	0.396930893584465
sp|A5UEU3|PUR5_HAEIG Phosphoribosylformylglycinamidine cyclo-ligase OS=Haemophilus influenzae (strain PittGG) OX=374931 GN=purM PE=3 SV=1	sp|Q4QKF3|PUR5_HAEI8 Phosphoribosylformylglycinamidine cyclo-ligase OS=Haemophilus influenzae (strain 86-028NP) OX=281310 GN=purM PE=3 SV=1	0.9871642718496255
sp|Q9ST99|PROF2_TOBAC Profilin-2 OS=Nicotiana tabacum OX=4097 GN=PRO2 PE=1 SV=1	sp|O24171|PROFC_OLEEU Profilin-3 OS=Olea europaea OX=4146 GN=PRO3 PE=1 SV=1	0.8705469135561056
sp|A3CV35|PAN_METMJ Proteasome-activating nucleotidase OS=Methanoculleus marisnigri (strain ATCC 35101 / DSM 1498 / JR1) OX=368407 GN=pan PE=3 SV=1	sp|A3CV35|PAN_METMJ Proteasome-activating nucleotidase OS=Methanoculleus marisnigri (strain ATCC 35101 / DSM 1498 / JR1) OX=368407 GN=pan PE=3 SV=1	1.0
sp|Q2T7S9|HOA_BURTA 4-hydroxy-2-oxovalerate aldolase OS=Burkholderia thailandensis (strain ATCC 700388 / DSM 13276 / CCUG 48851 / CIP 106301 / E264) OX=271848 GN=mhpE PE=3 SV=1	sp|A3NML2|HOA_BURP6 4-hydroxy-2-oxovalerate aldolase OS=Burkholderia pseudomallei (strain 668) OX=320373 GN=mhpE PE=3 SV=1	0.9764743116221564
sp|A3QF58|Y2240_SHELP UPF0276 protein Shew_2240 OS=Shewanella loihica (strain ATCC BAA-1088 / PV-4) OX=323850 GN=Shew_2240 PE=3 SV=1	sp|A3QF58|Y2240_SHELP UPF0276 protein Shew_2240 OS=Shewanella loihica (strain ATCC BAA-1088 / PV-4) OX=323850 GN=Shew_2240 PE=3 SV=1	1.0
sp|B8EB47|GCST_SHEB2 Aminomethyltransferase OS=Shewanella baltica (strain OS223) OX=407976 GN=gcvT PE=3 SV=1	sp|A1S967|GCST_SHEAM Aminomethyltransferase OS=Shewanella amazonensis (strain ATCC BAA-1098 / SB2B) OX=326297 GN=gcvT PE=3 SV=1	0.9023645900025415
sp|A5F3K0|EFTU_VIBC3 Elongation factor Tu OS=Vibrio cholerae serotype O1 (strain ATCC 39541 / Classical Ogawa 395 / O395) OX=345073 GN=tuf1 PE=3 SV=1	sp|Q7MH43|EFTU1_VIBVY Elongation factor Tu 1 OS=Vibrio vulnificus (strain YJ016) OX=196600 GN=tuf1 PE=3 SV=1	0.9610911783329776
sp|A6QIW4|RL31B_STAAE Large ribosomal subunit protein bL31B OS=Staphylococcus aureus (strain Newman) OX=426430 GN=rpmE2 PE=3 SV=1	sp|Q6G7J0|RL31B_STAAS Large ribosomal subunit protein bL31B OS=Staphylococcus aureus (strain MSSA476) OX=282459 GN=rpmE2 PE=3 SV=1	1.0
sp|P42732|RR13_ARATH Small ribosomal subunit protein uS13c OS=Arabidopsis thaliana OX=3702 GN=RPS13 PE=2 SV=1	sp|Q601J1|RS13_MESH2 Small ribosomal subunit protein uS13 OS=Mesomycoplasma hyopneumoniae (strain 232) OX=295358 GN=rpsM PE=3 SV=1	0.37245966423191423
