sp|B7LWC4|YAEH_ESCF3 UPF0325 protein YaeH OS=Escherichia fergusonii (strain ATCC 35469 / DSM 13698 / CCUG 18766 / IAM 14443 / JCM 21226 / LMG 7866 / NBRC 102419 / NCTC 12128 / CDC 0568-73) OX=585054 GN=yaeH PE=3 SV=1	sp|B2U306|YAEH_SHIB3 UPF0325 protein YaeH OS=Shigella boydii serotype 18 (strain CDC 3083-94 / BS512) OX=344609 GN=yaeH PE=3 SV=1	0.998390591175299
sp|Q9Y2Q9|RT28_HUMAN Small ribosomal subunit protein bS1m OS=Homo sapiens OX=9606 GN=MRPS28 PE=1 SV=1	sp|Q9CY16|RT28_MOUSE Small ribosomal subunit protein bS1m OS=Mus musculus OX=10090 GN=Mrps28 PE=1 SV=1	0.5329646426073764
sp|E1W9M1|END8_SALTS Endonuclease 8 OS=Salmonella typhimurium (strain SL1344) OX=216597 GN=nei PE=3 SV=1	sp|Q5PCL7|END8_SALPA Endonuclease 8 OS=Salmonella paratyphi A (strain ATCC 9150 / SARB42) OX=295319 GN=nei PE=3 SV=1	0.9959681489792698
sp|Q8C0D4|RHG12_MOUSE Rho GTPase-activating protein 12 OS=Mus musculus OX=10090 GN=Arhgap12 PE=1 SV=2	sp|Q8C0D4|RHG12_MOUSE Rho GTPase-activating protein 12 OS=Mus musculus OX=10090 GN=Arhgap12 PE=1 SV=2	1.0
sp|O74137|EPD2_CANMA Protein EPD2 OS=Candida maltosa OX=5479 GN=EPD2 PE=3 SV=1	sp|O74137|EPD2_CANMA Protein EPD2 OS=Candida maltosa OX=5479 GN=EPD2 PE=3 SV=1	1.0
sp|P51535|GLB2_NIPBR Myoglobin OS=Nippostrongylus brasiliensis OX=27835 GN=GLBB PE=2 SV=1	sp|A7HD40|TATA_ANADF Sec-independent protein translocase protein TatA OS=Anaeromyxobacter sp. (strain Fw109-5) OX=404589 GN=tatA PE=3 SV=1	0.2811855199407945
sp|Q47LK4|RL24_THEFY Large ribosomal subunit protein uL24 OS=Thermobifida fusca (strain YX) OX=269800 GN=rplX PE=3 SV=1	sp|A4VSG5|RL24_STRSY Large ribosomal subunit protein uL24 OS=Streptococcus suis (strain 05ZYH33) OX=391295 GN=rplX PE=3 SV=1	0.4619886078235184
sp|Q1EBV6|BPM5_ARATH BTB/POZ and MATH domain-containing protein 5 OS=Arabidopsis thaliana OX=3702 GN=BPM5 PE=1 SV=1	sp|Q8HVN4|NDHI_PARHY NAD(P)H-quinone oxidoreductase subunit I, chloroplastic OS=Parthenium hysterophorus OX=183063 GN=ndhI PE=3 SV=1	0.18727537629616478
sp|A8FMA1|DAPE_CAMJ8 Succinyl-diaminopimelate desuccinylase OS=Campylobacter jejuni subsp. jejuni serotype O:6 (strain 81116 / NCTC 11828) OX=407148 GN=dapE PE=3 SV=1	sp|A7I005|DAPE_CAMHC Succinyl-diaminopimelate desuccinylase OS=Campylobacter hominis (strain ATCC BAA-381 / DSM 21671 / CCUG 45161 / LMG 19568 / NCTC 13146 / CH001A) OX=360107 GN=dapE PE=3 SV=1	0.5498907119259068
sp|B1LKE8|FOLD_ECOSM Bifunctional protein FolD OS=Escherichia coli (strain SMS-3-5 / SECEC) OX=439855 GN=folD PE=3 SV=1	sp|B7N983|FOLD_ECOLU Bifunctional protein FolD OS=Escherichia coli O17:K52:H18 (strain UMN026 / ExPEC) OX=585056 GN=folD PE=3 SV=1	1.0
sp|Q82EA6|DISA_STRAW DNA integrity scanning protein DisA OS=Streptomyces avermitilis (strain ATCC 31267 / DSM 46492 / JCM 5070 / NBRC 14893 / NCIMB 12804 / NRRL 8165 / MA-4680) OX=227882 GN=disA PE=3 SV=1	sp|A5U8R1|DISA_MYCTA DNA integrity scanning protein DisA OS=Mycobacterium tuberculosis (strain ATCC 25177 / H37Ra) OX=419947 GN=disA PE=3 SV=1	0.5904083003854858
sp|P0A4K5|PMRA_STRR6 Multi-drug resistance efflux pump PmrA OS=Streptococcus pneumoniae (strain ATCC BAA-255 / R6) OX=171101 GN=pmrA PE=3 SV=1	sp|P58120|PMRA_LACLA Multi-drug resistance efflux pump PmrA homolog OS=Lactococcus lactis subsp. lactis (strain IL1403) OX=272623 GN=pmrA PE=3 SV=1	0.37229795929083725
sp|Q6FDF6|BETT1_ACIAD Osmo-independent choline transporter BetT1 OS=Acinetobacter baylyi (strain ATCC 33305 / BD413 / ADP1) OX=62977 GN=betT1 PE=1 SV=1	sp|Q79VE0|ECTP_CORGL Ectoine/glycine betaine/proline transporter EctP OS=Corynebacterium glutamicum (strain ATCC 13032 / DSM 20300 / JCM 1318 / BCRC 11384 / CCUG 27702 / LMG 3730 / NBRC 12168 / NCIMB 10025 / NRRL B-2784 / 534) OX=196627 GN=ectP PE=1 SV=1	0.23419380849899893
sp|A7HPQ7|DAPD_PARL1 2,3,4,5-tetrahydropyridine-2,6-dicarboxylate N-succinyltransferase OS=Parvibaculum lavamentivorans (strain DS-1 / DSM 13023 / NCIMB 13966) OX=402881 GN=dapD PE=3 SV=1	sp|Q6G549|DAPD_BARHE 2,3,4,5-tetrahydropyridine-2,6-dicarboxylate N-succinyltransferase OS=Bartonella henselae (strain ATCC 49882 / DSM 28221 / CCUG 30454 / Houston 1) OX=283166 GN=dapD PE=1 SV=1	0.6797858964325607
sp|D3UAG5|88F1R_MALDO Phloretin 2'-O-glucosyltransferase OS=Malus domestica OX=3750 GN=UGT88F1 PE=2 SV=1	sp|D3UAG7|U88F3_PYRCO UDP-glycosyltransferase 88F3 OS=Pyrus communis OX=23211 GN=UGT88F3 PE=2 SV=1	0.576945716794222
sp|O33405|MBHS_AFIC5 Uptake hydrogenase small subunit OS=Afipia carboxidovorans (strain ATCC 49405 / DSM 1227 / KCTC 32145 / OM5) OX=504832 GN=hoxS PE=1 SV=3	sp|P31892|MBHS_CUPNH Uptake hydrogenase small subunit OS=Cupriavidus necator (strain ATCC 17699 / DSM 428 / KCTC 22496 / NCIMB 10442 / H16 / Stanier 337) OX=381666 GN=hoxK PE=1 SV=1	0.8214189721980418
sp|Q9P7C2|MU109_SCHPO Meiotically up-regulated gene 109 protein OS=Schizosaccharomyces pombe (strain 972 / ATCC 24843) OX=284812 GN=mug109 PE=1 SV=1	sp|Q9P7C2|MU109_SCHPO Meiotically up-regulated gene 109 protein OS=Schizosaccharomyces pombe (strain 972 / ATCC 24843) OX=284812 GN=mug109 PE=1 SV=1	1.0
sp|A7ZJS7|RLMC_ECO24 23S rRNA (uracil(747)-C(5))-methyltransferase RlmC OS=Escherichia coli O139:H28 (strain E24377A / ETEC) OX=331111 GN=rlmC PE=3 SV=1	sp|Q3Z3S5|RLMC_SHISS 23S rRNA (uracil(747)-C(5))-methyltransferase RlmC OS=Shigella sonnei (strain Ss046) OX=300269 GN=rlmC PE=3 SV=1	0.9973643629359401
sp|B7LE45|PYRD_ECO55 Dihydroorotate dehydrogenase (quinone) OS=Escherichia coli (strain 55989 / EAEC) OX=585055 GN=pyrD PE=3 SV=1	sp|B1IVY7|PYRD_ECOLC Dihydroorotate dehydrogenase (quinone) OS=Escherichia coli (strain ATCC 8739 / DSM 1576 / NBRC 3972 / NCIMB 8545 / WDCM 00012 / Crooks) OX=481805 GN=pyrD PE=3 SV=1	1.0
sp|Q8V432|NCAP_CVBLU Nucleoprotein OS=Bovine coronavirus (strain 98TXSF-110-LUN) OX=233264 GN=N PE=3 SV=1	sp|Q91A22|NCAP_CVBEN Nucleoprotein OS=Bovine coronavirus (strain 98TXSF-110-ENT) OX=233262 GN=N PE=3 SV=1	0.994533064460944
sp|A7ZW55|GUAC_ECOHS GMP reductase OS=Escherichia coli O9:H4 (strain HS) OX=331112 GN=guaC PE=3 SV=1	sp|P60560|GUAC_ECOLI GMP reductase OS=Escherichia coli (strain K12) OX=83333 GN=guaC PE=1 SV=1	1.0
sp|B5E6M0|APT_STRP4 Adenine phosphoribosyltransferase OS=Streptococcus pneumoniae serotype 19F (strain G54) OX=512566 GN=apt PE=3 SV=1	sp|Q03K92|APT_STRTD Adenine phosphoribosyltransferase OS=Streptococcus thermophilus (strain ATCC BAA-491 / LMD-9) OX=322159 GN=apt PE=3 SV=1	0.8055028573620824
sp|Q51826|FIMA3_PORGN Major fimbrium subunit FimA type-3 OS=Porphyromonas gingivalis OX=837 GN=fimA PE=3 SV=2	sp|Q51822|FIMA2_PORGN Major fimbrium subunit FimA type-2 OS=Porphyromonas gingivalis OX=837 GN=fimA PE=1 SV=2	0.38654220079853313
sp|B1XCM1|GSH1_ECODH Glutamate--cysteine ligase OS=Escherichia coli (strain K12 / DH10B) OX=316385 GN=gshA PE=3 SV=1	sp|C4ZYT8|GSH1_ECOBW Glutamate--cysteine ligase OS=Escherichia coli (strain K12 / MC4100 / BW2952) OX=595496 GN=gshA PE=3 SV=1	1.0
sp|Q6N8C3|RPIA_RHOPA Ribose-5-phosphate isomerase A OS=Rhodopseudomonas palustris (strain ATCC BAA-98 / CGA009) OX=258594 GN=rpiA PE=3 SV=1	sp|A7HS32|RPIA_PARL1 Ribose-5-phosphate isomerase A OS=Parvibaculum lavamentivorans (strain DS-1 / DSM 13023 / NCIMB 13966) OX=402881 GN=rpiA PE=3 SV=1	0.6332067645074849
sp|Q6NS65|GPR17_MOUSE Uracil nucleotide/cysteinyl leukotriene receptor OS=Mus musculus OX=10090 GN=Gpr17 PE=1 SV=1	sp|Q2NNR5|CLTR1_CAVPO Cysteinyl leukotriene receptor 1 OS=Cavia porcellus OX=10141 GN=CYSLTR1 PE=2 SV=1	0.237054544487498
sp|B2FT17|RNPH_STRMK Ribonuclease PH OS=Stenotrophomonas maltophilia (strain K279a) OX=522373 GN=rph PE=3 SV=1	sp|B2FT17|RNPH_STRMK Ribonuclease PH OS=Stenotrophomonas maltophilia (strain K279a) OX=522373 GN=rph PE=3 SV=1	1.0
sp|P01289|TKN1_BOVIN Protachykinin-1 OS=Bos taurus OX=9913 GN=TAC1 PE=1 SV=2	sp|P41539|TKN1_MOUSE Protachykinin-1 OS=Mus musculus OX=10090 GN=Tac1 PE=2 SV=1	0.9423365325423646
sp|Q604V8|MURC_METCA UDP-N-acetylmuramate--L-alanine ligase OS=Methylococcus capsulatus (strain ATCC 33009 / NCIMB 11132 / Bath) OX=243233 GN=murC PE=3 SV=1	sp|A6VB84|MURC_PSEA7 UDP-N-acetylmuramate--L-alanine ligase OS=Pseudomonas aeruginosa (strain PA7) OX=381754 GN=murC PE=3 SV=1	0.6400564172211005
sp|O77517|B2MG_SAGMN Beta-2-microglobulin OS=Saguinus niger OX=356665 GN=B2M PE=3 SV=1	sp|P63063|B2MG_AOTLE Beta-2-microglobulin OS=Aotus lemurinus OX=43147 GN=B2M PE=3 SV=1	0.931692959006383
sp|P62918|RL8_MOUSE Large ribosomal subunit protein uL2 OS=Mus musculus OX=10090 GN=Rpl8 PE=1 SV=2	sp|P62918|RL8_MOUSE Large ribosomal subunit protein uL2 OS=Mus musculus OX=10090 GN=Rpl8 PE=1 SV=2	1.0
sp|Q2YJ67|FLGH_BRUA2 Flagellar L-ring protein OS=Brucella abortus (strain 2308) OX=359391 GN=flgH PE=3 SV=2	sp|A8IPJ4|FLGH_AZOC5 Flagellar L-ring protein OS=Azorhizobium caulinodans (strain ATCC 43989 / DSM 5975 / JCM 20966 / LMG 6465 / NBRC 14845 / NCIMB 13405 / ORS 571) OX=438753 GN=flgH PE=3 SV=1	0.5399888024657118
sp|B9LCT9|XPT_CHLSY Xanthine phosphoribosyltransferase OS=Chloroflexus aurantiacus (strain ATCC 29364 / DSM 637 / Y-400-fl) OX=480224 GN=xpt PE=3 SV=1	sp|B9LCT9|XPT_CHLSY Xanthine phosphoribosyltransferase OS=Chloroflexus aurantiacus (strain ATCC 29364 / DSM 637 / Y-400-fl) OX=480224 GN=xpt PE=3 SV=1	1.0
sp|B7NSE0|GLAH_ECO7I Glutarate 2-hydroxylase OS=Escherichia coli O7:K1 (strain IAI39 / ExPEC) OX=585057 GN=glaH PE=3 SV=1	sp|A8A3E0|GLAH_ECOHS Glutarate 2-hydroxylase OS=Escherichia coli O9:H4 (strain HS) OX=331112 GN=glaH PE=3 SV=1	0.9819166902752358
sp|Q6CPQ2|SIA1_KLULA Protein SIA1 OS=Kluyveromyces lactis (strain ATCC 8585 / CBS 2359 / DSM 70799 / NBRC 1267 / NRRL Y-1140 / WM37) OX=284590 GN=SIA1 PE=3 SV=1	sp|Q7MMW9|Y948_VIBVY UPF0319 protein VV0948 OS=Vibrio vulnificus (strain YJ016) OX=196600 GN=VV0948 PE=3 SV=1	0.1824830862456555
sp|Q5E8C7|SLYX_ALIF1 Protein SlyX homolog OS=Aliivibrio fischeri (strain ATCC 700601 / ES114) OX=312309 GN=slyX PE=3 SV=1	sp|B5FFZ7|SLYX_ALIFM Protein SlyX homolog OS=Aliivibrio fischeri (strain MJ11) OX=388396 GN=slyX PE=3 SV=1	1.0
sp|Q0TAF8|RHAS_ECOL5 HTH-type transcriptional activator RhaS OS=Escherichia coli O6:K15:H31 (strain 536 / UPEC) OX=362663 GN=rhaS PE=3 SV=1	sp|P09377|RHAS_ECOLI HTH-type transcriptional activator RhaS OS=Escherichia coli (strain K12) OX=83333 GN=rhaS PE=1 SV=1	0.9879420164327705
sp|A2ADA5|PUSL1_MOUSE tRNA pseudouridine synthase-like 1 OS=Mus musculus OX=10090 GN=Pusl1 PE=1 SV=1	sp|Q32L00|ALKB3_BOVIN Alpha-ketoglutarate-dependent dioxygenase alkB homolog 3 OS=Bos taurus OX=9913 GN=ALKBH3 PE=2 SV=1	0.22202986179770878
sp|B4RKF2|RL25_NEIG2 Large ribosomal subunit protein bL25 OS=Neisseria gonorrhoeae (strain NCCP11945) OX=521006 GN=rplY PE=3 SV=1	sp|C1DBA9|RL25_LARHH Large ribosomal subunit protein bL25 OS=Laribacter hongkongensis (strain HLHK9) OX=557598 GN=rplY PE=3 SV=1	0.5259014903539803
sp|P59931|SSB_HELHP Single-stranded DNA-binding protein OS=Helicobacter hepaticus (strain ATCC 51449 / 3B1) OX=235279 GN=ssb PE=3 SV=1	sp|Q8PIJ2|SSB_XANAC Single-stranded DNA-binding protein OS=Xanthomonas axonopodis pv. citri (strain 306) OX=190486 GN=ssb PE=3 SV=1	0.33181095705676417
sp|P9WFD8|Y2028_MYCTO Universal stress protein MT2087 OS=Mycobacterium tuberculosis (strain CDC 1551 / Oshkosh) OX=83331 GN=MT2087 PE=2 SV=1	sp|Q46755|SIRB2_ECOLI Protein YchQ OS=Escherichia coli (strain K12) OX=83333 GN=ychQ PE=1 SV=1	0.2095735069052203
sp|P9WNM9|EFGL_MYCTU Elongation factor G-like protein OS=Mycobacterium tuberculosis (strain ATCC 25618 / H37Rv) OX=83332 GN=Rv0120c PE=1 SV=1	sp|Q0HNU0|EFG1_SHESM Elongation factor G 1 OS=Shewanella sp. (strain MR-4) OX=60480 GN=fusA1 PE=3 SV=1	0.24407842144355066
sp|B5EE49|MIAB_CITBB tRNA-2-methylthio-N(6)-dimethylallyladenosine synthase OS=Citrifermentans bemidjiense (strain ATCC BAA-1014 / DSM 16622 / JCM 12645 / Bem) OX=404380 GN=miaB PE=3 SV=1	sp|Q2LT94|MIAB_SYNAS tRNA-2-methylthio-N(6)-dimethylallyladenosine synthase OS=Syntrophus aciditrophicus (strain SB) OX=56780 GN=miaB PE=3 SV=1	0.4526034480680579
sp|P59639|CLCA_SHIFL H(+)/Cl(-) exchange transporter ClcA OS=Shigella flexneri OX=623 GN=clcA PE=3 SV=1	sp|B6HZD1|CLCA_ECOSE H(+)/Cl(-) exchange transporter ClcA OS=Escherichia coli (strain SE11) OX=409438 GN=clcA PE=3 SV=1	0.9883553178966363
sp|Q0KL00|PIEZ1_RAT Piezo-type mechanosensitive ion channel component 1 OS=Rattus norvegicus OX=10116 GN=Piezo1 PE=1 SV=3	sp|G0REX6|ILIA_HYPJQ Hybrid PKS-NRPS synthetase iliA OS=Hypocrea jecorina (strain QM6a) OX=431241 GN=iliA PE=1 SV=1	0.09626858346729988
sp|B5EZR9|FADJ_SALA4 Fatty acid oxidation complex subunit alpha OS=Salmonella agona (strain SL483) OX=454166 GN=fadJ PE=3 SV=1	sp|Q8FFG4|FADJ_ECOL6 Fatty acid oxidation complex subunit alpha OS=Escherichia coli O6:H1 (strain CFT073 / ATCC 700928 / UPEC) OX=199310 GN=fadJ PE=3 SV=1	0.8674478080271885
sp|Q3SLM3|RL17_THIDA Large ribosomal subunit protein bL17 OS=Thiobacillus denitrificans (strain ATCC 25259 / T1) OX=292415 GN=rplQ PE=3 SV=1	sp|A6VLL4|RL17_ACTSZ Large ribosomal subunit protein bL17 OS=Actinobacillus succinogenes (strain ATCC 55618 / DSM 22257 / CCUG 43843 / 130Z) OX=339671 GN=rplQ PE=3 SV=1	0.7728415545327179
sp|P0C389|CYF_ORYSJ Cytochrome f OS=Oryza sativa subsp. japonica OX=39947 GN=petA PE=3 SV=1	sp|Q6ENV1|CYF_SACOF Cytochrome f OS=Saccharum officinarum OX=4547 GN=petA PE=3 SV=1	0.9876254333107778
sp|Q47NB5|UVRC_THEFY UvrABC system protein C OS=Thermobifida fusca (strain YX) OX=269800 GN=uvrC PE=3 SV=1	sp|Q6AF49|UVRC_LEIXX UvrABC system protein C OS=Leifsonia xyli subsp. xyli (strain CTCB07) OX=281090 GN=uvrC PE=3 SV=1	0.3549663483250894
sp|Q3AKK1|GLGA_SYNSC Glycogen synthase OS=Synechococcus sp. (strain CC9605) OX=110662 GN=glgA PE=3 SV=1	sp|A5GKI7|GLGA_SYNPW Glycogen synthase OS=Synechococcus sp. (strain WH7803) OX=32051 GN=glgA PE=3 SV=1	0.7811929098066448
sp|Q3A9M2|SYK_CARHZ Lysine--tRNA ligase OS=Carboxydothermus hydrogenoformans (strain ATCC BAA-161 / DSM 6008 / Z-2901) OX=246194 GN=lysS PE=3 SV=1	sp|Q6GJF4|SYK_STAAR Lysine--tRNA ligase OS=Staphylococcus aureus (strain MRSA252) OX=282458 GN=lysS PE=3 SV=1	0.5734147740007636
sp|Q09322|CUP15_CAEEL Coelomocyte uptake defective protein 15 OS=Caenorhabditis elegans OX=6239 GN=cup-15 PE=1 SV=2	sp|A9KET4|Y1993_COXBN UPF0234 protein CBUD_1993 OS=Coxiella burnetii (strain Dugway 5J108-111) OX=434922 GN=CBUD_1993 PE=3 SV=1	0.2156747666661876
sp|Q8GXG6|B3GTH_ARATH Hydroxyproline O-galactosyltransferase GALT4 OS=Arabidopsis thaliana OX=3702 GN=GALT4 PE=2 SV=2	sp|P0C0P7|NPS_RAT Neuropeptide S OS=Rattus norvegicus OX=10116 GN=Nps PE=2 SV=1	0.14834585771014377
sp|O03064|ATPB_ADIRA ATP synthase subunit beta, chloroplastic (Fragment) OS=Adiantum raddianum OX=32168 GN=atpB PE=3 SV=2	sp|O03085|ATPB_VANDA ATP synthase subunit beta, chloroplastic (Fragment) OS=Vandenboschia davallioides OX=29621 GN=atpB PE=3 SV=3	0.7279765644446992
sp|P46159|DEFB1_BOVIN Beta-defensin 1 OS=Bos taurus OX=9913 GN=DEFB1 PE=1 SV=1	sp|P46170|DFB12_BOVIN Beta-defensin 12 OS=Bos taurus OX=9913 GN=DEFB12 PE=1 SV=1	0.5710674766431716
sp|Q9D5Y0|SMIP4_MOUSE Sperm-associated microtubule inner protein 4 OS=Mus musculus OX=10090 GN=Spmip4 PE=2 SV=1	sp|Q7T1R4|FOXA2_XENTR Forkhead box protein A2 OS=Xenopus tropicalis OX=8364 GN=foxa2 PE=2 SV=1	0.15679186852158328
sp|Q1GGT9|HIS3_RUEST Phosphoribosyl-AMP cyclohydrolase OS=Ruegeria sp. (strain TM1040) OX=292414 GN=hisI PE=3 SV=1	sp|A8LK58|HIS3_DINSH Phosphoribosyl-AMP cyclohydrolase OS=Dinoroseobacter shibae (strain DSM 16493 / NCIMB 14021 / DFL 12) OX=398580 GN=hisI PE=3 SV=1	0.7133688365101976
sp|Q5HPY6|PYRE_STAEQ Orotate phosphoribosyltransferase OS=Staphylococcus epidermidis (strain ATCC 35984 / DSM 28319 / BCRC 17069 / CCUG 31568 / BM 3577 / RP62A) OX=176279 GN=pyrE PE=3 SV=1	sp|A8AXM7|PYRE_STRGC Orotate phosphoribosyltransferase OS=Streptococcus gordonii (strain Challis / ATCC 35105 / BCRC 15272 / CH1 / DL1 / V288) OX=467705 GN=pyrE PE=3 SV=1	0.6357311305083568
sp|B3R2P7|RS6_CUPTR Small ribosomal subunit protein bS6 OS=Cupriavidus taiwanensis (strain DSM 17343 / BCRC 17206 / CCUG 44338 / CIP 107171 / LMG 19424 / R1) OX=977880 GN=rpsF PE=3 SV=1	sp|Q0BEQ6|RS6_BURCM Small ribosomal subunit protein bS6 OS=Burkholderia ambifaria (strain ATCC BAA-244 / DSM 16087 / CCUG 44356 / LMG 19182 / AMMD) OX=339670 GN=rpsF PE=3 SV=1	0.8205327877734837
sp|Q3AA16|SYH_CARHZ Histidine--tRNA ligase OS=Carboxydothermus hydrogenoformans (strain ATCC BAA-161 / DSM 6008 / Z-2901) OX=246194 GN=hisS PE=3 SV=1	sp|Q3AA16|SYH_CARHZ Histidine--tRNA ligase OS=Carboxydothermus hydrogenoformans (strain ATCC BAA-161 / DSM 6008 / Z-2901) OX=246194 GN=hisS PE=3 SV=1	1.0
sp|Q7UZX6|PSAL_PROMP Photosystem I reaction center subunit XI OS=Prochlorococcus marinus subsp. pastoris (strain CCMP1986 / NIES-2087 / MED4) OX=59919 GN=psaL PE=3 SV=1	sp|A8G719|PSAL_PROM2 Photosystem I reaction center subunit XI OS=Prochlorococcus marinus (strain MIT 9215) OX=93060 GN=psaL PE=3 SV=1	0.9465132695454033
sp|Q8GY25|WOX12_ARATH WUSCHEL-related homeobox 12 OS=Arabidopsis thaliana OX=3702 GN=WOX12 PE=2 SV=1	sp|Q8GY25|WOX12_ARATH WUSCHEL-related homeobox 12 OS=Arabidopsis thaliana OX=3702 GN=WOX12 PE=2 SV=1	1.0
sp|P49840|GSK3A_HUMAN Glycogen synthase kinase-3 alpha OS=Homo sapiens OX=9606 GN=GSK3A PE=1 SV=2	sp|P18266|GSK3B_RAT Glycogen synthase kinase-3 beta OS=Rattus norvegicus OX=10116 GN=Gsk3b PE=1 SV=1	0.6813499583935373
sp|Q04Y84|MRAY_LEPBL Phospho-N-acetylmuramoyl-pentapeptide-transferase OS=Leptospira borgpetersenii serovar Hardjo-bovis (strain L550) OX=355276 GN=mraY PE=3 SV=1	sp|Q3J786|MRAY_NITOC Phospho-N-acetylmuramoyl-pentapeptide-transferase OS=Nitrosococcus oceani (strain ATCC 19707 / BCRC 17464 / JCM 30415 / NCIMB 11848 / C-107) OX=323261 GN=mraY PE=3 SV=1	0.383730591218082
sp|A5GL79|COAD_SYNPW Phosphopantetheine adenylyltransferase OS=Synechococcus sp. (strain WH7803) OX=32051 GN=coaD PE=3 SV=1	sp|Q3AXV0|COAD_SYNS9 Phosphopantetheine adenylyltransferase OS=Synechococcus sp. (strain CC9902) OX=316279 GN=coaD PE=3 SV=1	0.7312431237485421
sp|Q2W3T1|NAPA_PARM1 Periplasmic nitrate reductase OS=Paramagnetospirillum magneticum (strain ATCC 700264 / AMB-1) OX=342108 GN=napA PE=3 SV=1	sp|B3R8B4|NAPA_CUPTR Periplasmic nitrate reductase OS=Cupriavidus taiwanensis (strain DSM 17343 / BCRC 17206 / CCUG 44338 / CIP 107171 / LMG 19424 / R1) OX=977880 GN=napA PE=3 SV=1	0.6503809336204158
sp|Q2FKP1|RL9_STAA3 Large ribosomal subunit protein bL9 OS=Staphylococcus aureus (strain USA300) OX=367830 GN=rplI PE=3 SV=1	sp|P66317|RL9_STAAM Large ribosomal subunit protein bL9 OS=Staphylococcus aureus (strain Mu50 / ATCC 700699) OX=158878 GN=rplI PE=3 SV=1	1.0
sp|B3EWP0|HFQ_PSEAI RNA-binding protein Hfq OS=Pseudomonas aeruginosa OX=287 GN=hfq PE=1 SV=1	sp|A6VYL6|HFQ_MARMS RNA-binding protein Hfq OS=Marinomonas sp. (strain MWYL1) OX=400668 GN=hfq PE=3 SV=1	0.8322247298217481
sp|C3MHC0|RNH2_SINFN Ribonuclease HII OS=Sinorhizobium fredii (strain NBRC 101917 / NGR234) OX=394 GN=rnhB PE=3 SV=1	sp|Q1GD84|RNH2_RUEST Ribonuclease HII OS=Ruegeria sp. (strain TM1040) OX=292414 GN=rnhB PE=3 SV=1	0.3863680576265782
sp|Q8IYB1|M21D2_HUMAN Nucleotidyltransferase MB21D2 OS=Homo sapiens OX=9606 GN=MB21D2 PE=1 SV=3	sp|Q7V0U6|YCF4_PROMP Photosystem I assembly protein Ycf4 OS=Prochlorococcus marinus subsp. pastoris (strain CCMP1986 / NIES-2087 / MED4) OX=59919 GN=ycf4 PE=3 SV=1	0.18353334819979253
sp|B2GB28|Y524_LIMF3 UPF0473 protein LAF_0524 OS=Limosilactobacillus fermentum (strain NBRC 3956 / LMG 18251) OX=334390 GN=LAF_0524 PE=3 SV=1	sp|Q88V14|Y2273_LACPL UPF0473 protein lp_2273 OS=Lactiplantibacillus plantarum (strain ATCC BAA-793 / NCIMB 8826 / WCFS1) OX=220668 GN=lp_2273 PE=3 SV=1	0.35494435769274646
sp|B0UVX7|GLPB_HISS2 Anaerobic glycerol-3-phosphate dehydrogenase subunit B OS=Histophilus somni (strain 2336) OX=228400 GN=glpB PE=3 SV=1	sp|B3H0P4|GLPB_ACTP7 Anaerobic glycerol-3-phosphate dehydrogenase subunit B OS=Actinobacillus pleuropneumoniae serotype 7 (strain AP76) OX=537457 GN=glpB PE=3 SV=1	0.42977399688368073
sp|A7MH24|NUOCD_CROS8 NADH-quinone oxidoreductase subunit C/D OS=Cronobacter sakazakii (strain ATCC BAA-894) OX=290339 GN=nuoC PE=3 SV=1	sp|B6I7N6|NUOCD_ECOSE NADH-quinone oxidoreductase subunit C/D OS=Escherichia coli (strain SE11) OX=409438 GN=nuoC PE=3 SV=1	0.8923970575366915
sp|A5CDP5|PGK_ORITB Phosphoglycerate kinase OS=Orientia tsutsugamushi (strain Boryong) OX=357244 GN=pgk PE=3 SV=1	sp|A5CDP5|PGK_ORITB Phosphoglycerate kinase OS=Orientia tsutsugamushi (strain Boryong) OX=357244 GN=pgk PE=3 SV=1	1.0
sp|Q9VXE6|NU153_DROME Nuclear pore complex protein Nup153 OS=Drosophila melanogaster OX=7227 GN=Nup153 PE=1 SV=4	sp|Q3BWX5|RL29_XANE5 Large ribosomal subunit protein uL29 OS=Xanthomonas euvesicatoria pv. vesicatoria (strain 85-10) OX=316273 GN=rpmC PE=3 SV=1	0.10128018608846899
sp|Q5ZCI1|MPK10_ORYSJ Mitogen-activated protein kinase 10 OS=Oryza sativa subsp. japonica OX=39947 GN=MPK10 PE=2 SV=2	sp|Q53N72|MPK15_ORYSJ Mitogen-activated protein kinase 15 OS=Oryza sativa subsp. japonica OX=39947 GN=MPK15 PE=2 SV=1	0.5686071427204696
sp|Q9Z2F7|BNI3L_MOUSE BCL2/adenovirus E1B 19 kDa protein-interacting protein 3-like OS=Mus musculus OX=10090 GN=Bnip3l PE=1 SV=1	sp|Q9Z2F7|BNI3L_MOUSE BCL2/adenovirus E1B 19 kDa protein-interacting protein 3-like OS=Mus musculus OX=10090 GN=Bnip3l PE=1 SV=1	1.0
sp|Q5ZUT0|PYRH_LEGPH Uridylate kinase OS=Legionella pneumophila subsp. pneumophila (strain Philadelphia 1 / ATCC 33152 / DSM 7513) OX=272624 GN=pyrH PE=3 SV=1	sp|Q5WVY9|PYRH_LEGPL Uridylate kinase OS=Legionella pneumophila (strain Lens) OX=297245 GN=pyrH PE=3 SV=1	0.9927829146169064
sp|Q2NGN7|ARLY_METST Argininosuccinate lyase OS=Methanosphaera stadtmanae (strain ATCC 43021 / DSM 3091 / JCM 11832 / MCB-3) OX=339860 GN=argH PE=3 SV=1	sp|B8I1A0|ARLY_RUMCH Argininosuccinate lyase OS=Ruminiclostridium cellulolyticum (strain ATCC 35319 / DSM 5812 / JCM 6584 / H10) OX=394503 GN=argH PE=3 SV=1	0.38795883770886913
sp|Q9LMR3|TYRA2_ARATH Arogenate dehydrogenase 2, chloroplastic OS=Arabidopsis thaliana OX=3702 GN=TYRAAT2 PE=1 SV=1	sp|Q3SMK0|CH10_THIDA Co-chaperonin GroES OS=Thiobacillus denitrificans (strain ATCC 25259 / T1) OX=292415 GN=groES PE=3 SV=1	0.20636140370562672
sp|Q7VJY2|MNME_HELHP tRNA modification GTPase MnmE OS=Helicobacter hepaticus (strain ATCC 51449 / 3B1) OX=235279 GN=mnmE PE=3 SV=2	sp|A5GW82|MNME_SYNR3 tRNA modification GTPase MnmE OS=Synechococcus sp. (strain RCC307) OX=316278 GN=mnmE PE=3 SV=1	0.3082009443767361
sp|Q73H95|RS17_WOLPM Small ribosomal subunit protein uS17 OS=Wolbachia pipientis wMel OX=163164 GN=rpsQ PE=3 SV=1	sp|Q9ZCR4|RS17_RICPR Small ribosomal subunit protein uS17 OS=Rickettsia prowazekii (strain Madrid E) OX=272947 GN=rpsQ PE=3 SV=1	0.567446597988904
sp|Q5LLP0|HSLU_RUEPO ATP-dependent protease ATPase subunit HslU OS=Ruegeria pomeroyi (strain ATCC 700808 / DSM 15171 / DSS-3) OX=246200 GN=hslU PE=3 SV=1	sp|A4WWS0|HSLU_CERS5 ATP-dependent protease ATPase subunit HslU OS=Cereibacter sphaeroides (strain ATCC 17025 / ATH 2.4.3) OX=349102 GN=hslU PE=3 SV=1	0.4903031830256029
sp|Q5M8K0|R9BP_XENTR Regulator of G-protein signaling 9-binding protein OS=Xenopus tropicalis OX=8364 GN=rgs9bp PE=2 SV=1	sp|Q6GLU0|R9BPC_XENLA Regulator of G-protein signaling 9-binding protein C OS=Xenopus laevis OX=8355 GN=rgs9bp-c PE=2 SV=1	0.24140611376326165
sp|Q5R4E3|G6PI_PONAB Glucose-6-phosphate isomerase OS=Pongo abelii OX=9601 GN=GPI PE=2 SV=3	sp|Q3ZBD7|G6PI_BOVIN Glucose-6-phosphate isomerase OS=Bos taurus OX=9913 GN=GPI PE=2 SV=4	0.932966039183358
sp|Q46633|AMSC_ERWAM Amylovoran biosynthesis protein AmsC OS=Erwinia amylovora OX=552 GN=amsC PE=4 SV=2	sp|Q46633|AMSC_ERWAM Amylovoran biosynthesis protein AmsC OS=Erwinia amylovora OX=552 GN=amsC PE=4 SV=2	1.0
sp|Q05581|CAS1_STRCL Clavaminate synthase 1 OS=Streptomyces clavuligerus OX=1901 GN=cs1 PE=1 SV=3	sp|Q5HNW4|HRCA_STAEQ Heat-inducible transcription repressor HrcA OS=Staphylococcus epidermidis (strain ATCC 35984 / DSM 28319 / BCRC 17069 / CCUG 31568 / BM 3577 / RP62A) OX=176279 GN=hrcA PE=3 SV=1	0.20499434897055588
sp|B6QT52|FEN1_TALMQ Flap endonuclease 1 OS=Talaromyces marneffei (strain ATCC 18224 / CBS 334.59 / QM 7333) OX=441960 GN=fen1 PE=3 SV=2	sp|A1CJ75|FEN1_ASPCL Flap endonuclease 1 OS=Aspergillus clavatus (strain ATCC 1007 / CBS 513.65 / DSM 816 / NCTC 3887 / NRRL 1 / QM 1276 / 107) OX=344612 GN=fen1 PE=3 SV=2	0.9093208695086226
sp|P47979|ZFS1_SCHPO Zinc finger protein zfs1 OS=Schizosaccharomyces pombe (strain 972 / ATCC 24843) OX=284812 GN=zfs1 PE=1 SV=1	sp|E0SBQ8|SBMC2_DICD3 DNA gyrase inhibitor 2 OS=Dickeya dadantii (strain 3937) OX=198628 GN=sbmC2 PE=3 SV=1	0.18371224646847603
sp|Q89BQ2|RL34_BRADU Large ribosomal subunit protein bL34 OS=Bradyrhizobium diazoefficiens (strain JCM 10833 / BCRC 13528 / IAM 13628 / NBRC 14792 / USDA 110) OX=224911 GN=rpmH PE=3 SV=1	sp|Q89BQ2|RL34_BRADU Large ribosomal subunit protein bL34 OS=Bradyrhizobium diazoefficiens (strain JCM 10833 / BCRC 13528 / IAM 13628 / NBRC 14792 / USDA 110) OX=224911 GN=rpmH PE=3 SV=1	1.0
sp|Q3YQP0|SYT_EHRCJ Threonine--tRNA ligase OS=Ehrlichia canis (strain Jake) OX=269484 GN=thrS PE=3 SV=1	sp|Q5H9Z4|SYT_EHRRW Threonine--tRNA ligase OS=Ehrlichia ruminantium (strain Welgevonden) OX=254945 GN=thrS PE=3 SV=1	0.8300832492156475
sp|Q80XA0|TM121_MOUSE Transmembrane protein 121 OS=Mus musculus OX=10090 GN=Tmem121 PE=2 SV=1	sp|A7GJ59|RL6_CLOBL Large ribosomal subunit protein uL6 OS=Clostridium botulinum (strain Langeland / NCTC 10281 / Type F) OX=441772 GN=rplF PE=3 SV=1	0.20233317393391004
sp|A3CUS9|PSB_METMJ Proteasome subunit beta OS=Methanoculleus marisnigri (strain ATCC 35101 / DSM 1498 / JR1) OX=368407 GN=psmB PE=3 SV=1	sp|A7I841|PSB_METB6 Proteasome subunit beta OS=Methanoregula boonei (strain DSM 21154 / JCM 14090 / 6A8) OX=456442 GN=psmB PE=3 SV=1	0.7394625021987452
sp|A9UTP3|PURA_MONBE Adenylosuccinate synthetase OS=Monosiga brevicollis OX=81824 GN=20027 PE=3 SV=1	sp|C1DLQ8|PURA_AZOVD Adenylosuccinate synthetase OS=Azotobacter vinelandii (strain DJ / ATCC BAA-1303) OX=322710 GN=purA PE=3 SV=1	0.44927218353253734
