sp|Q1J835|RL11_STRPF Large ribosomal subunit protein uL11 OS=Streptococcus pyogenes serotype M4 (strain MGAS10750) OX=370554 GN=rplK PE=3 SV=2	sp|Q1JI80|RL11_STRPD Large ribosomal subunit protein uL11 OS=Streptococcus pyogenes serotype M2 (strain MGAS10270) OX=370552 GN=rplK PE=3 SV=2	1.0
sp|D1ZIW5|CHO2_SORMK Phosphatidylethanolamine N-methyltransferase OS=Sordaria macrospora (strain ATCC MYA-333 / DSM 997 / K(L3346) / K-hell) OX=771870 GN=CHO2 PE=3 SV=1	sp|C7Z7C3|CHO2_FUSV7 Phosphatidylethanolamine N-methyltransferase OS=Fusarium vanettenii (strain ATCC MYA-4622 / CBS 123669 / FGSC 9596 / NRRL 45880 / 77-13-4) OX=660122 GN=CHO2 PE=3 SV=1	0.30332401621437705
sp|B6KAM0|AMA1_TOXGV Apical membrane antigen 1 OS=Toxoplasma gondii (strain ATCC 50861 / VEG) OX=432359 GN=AMA1 PE=1 SV=1	sp|Q27511|H2AV_CAEEL Histone H2A.V OS=Caenorhabditis elegans OX=6239 GN=htz-1 PE=1 SV=3	0.16169693899617105
sp|B0C075|RS2_ACAM1 Small ribosomal subunit protein uS2 OS=Acaryochloris marina (strain MBIC 11017) OX=329726 GN=rpsB PE=3 SV=1	sp|B8HXK4|RS2_CYAP4 Small ribosomal subunit protein uS2 OS=Cyanothece sp. (strain PCC 7425 / ATCC 29141) OX=395961 GN=rpsB PE=3 SV=1	0.6686684992067673
sp|Q7W400|GLYA2_BORPA Serine hydroxymethyltransferase 2 OS=Bordetella parapertussis (strain 12822 / ATCC BAA-587 / NCTC 13253) OX=257311 GN=glyA2 PE=3 SV=1	sp|Q7W400|GLYA2_BORPA Serine hydroxymethyltransferase 2 OS=Bordetella parapertussis (strain 12822 / ATCC BAA-587 / NCTC 13253) OX=257311 GN=glyA2 PE=3 SV=1	1.0
sp|P0A0R1|FTNA_NEIMB Bacterial ferritin OS=Neisseria meningitidis serogroup B (strain ATCC BAA-335 / MC58) OX=122586 GN=bfrA PE=3 SV=1	sp|Q9HY79|BFRB_PSEAE Bacterioferritin BfrB OS=Pseudomonas aeruginosa (strain ATCC 15692 / DSM 22644 / CIP 104116 / JCM 14847 / LMG 12228 / 1C / PRS 101 / PAO1) OX=208964 GN=bfrB PE=1 SV=1	0.32606374895838686
sp|B1XD49|FABZ_ECODH 3-hydroxyacyl-[acyl-carrier-protein] dehydratase FabZ OS=Escherichia coli (strain K12 / DH10B) OX=316385 GN=fabZ PE=3 SV=1	sp|B7NIE2|FABZ_ECO7I 3-hydroxyacyl-[acyl-carrier-protein] dehydratase FabZ OS=Escherichia coli O7:K1 (strain IAI39 / ExPEC) OX=585057 GN=fabZ PE=3 SV=1	1.0
sp|P08675|CSP_PLACL Circumsporozoite protein OS=Plasmodium cynomolgi (strain London) OX=5831 GN=CSP PE=3 SV=1	sp|P08676|CSP_PLACM Circumsporozoite protein OS=Plasmodium cynomolgi (strain Mulligan/NIH) OX=5832 GN=CSP PE=3 SV=3	0.3270693351197353
sp|B9KL95|RS19_CERSK Small ribosomal subunit protein uS19 OS=Cereibacter sphaeroides (strain KD131 / KCTC 12085) OX=557760 GN=rpsS PE=3 SV=1	sp|A4WVK4|RS19_CERS5 Small ribosomal subunit protein uS19 OS=Cereibacter sphaeroides (strain ATCC 17025 / ATH 2.4.3) OX=349102 GN=rpsS PE=3 SV=1	1.0
sp|Q7Z692|CEA19_HUMAN Cell adhesion molecule CEACAM19 OS=Homo sapiens OX=9606 GN=CEACAM19 PE=2 SV=2	sp|P0C6F9|AC4_ABMVW Protein AC4 OS=Abutilon mosaic virus (isolate West India) OX=10816 GN=AC4 PE=3 SV=1	0.22398006208302185
sp|A8GVL3|RL35_RICB8 Large ribosomal subunit protein bL35 OS=Rickettsia bellii (strain OSU 85-389) OX=391896 GN=rpmI PE=3 SV=1	sp|A8GSZ7|RL35_RICRS Large ribosomal subunit protein bL35 OS=Rickettsia rickettsii (strain Sheila Smith) OX=392021 GN=rpmI PE=3 SV=1	0.9604916027019912
sp|A5GQU6|RS21_SYNR3 Small ribosomal subunit protein bS21 OS=Synechococcus sp. (strain RCC307) OX=316278 GN=rpsU PE=3 SV=1	sp|A5GNP9|RS21_SYNPW Small ribosomal subunit protein bS21 OS=Synechococcus sp. (strain WH7803) OX=32051 GN=rpsU PE=3 SV=1	0.960045147520967
sp|P63148|UBE2B_RABIT Ubiquitin-conjugating enzyme E2 B OS=Oryctolagus cuniculus OX=9986 GN=UBE2B PE=2 SV=1	sp|P63147|UBE2B_MOUSE Ubiquitin-conjugating enzyme E2 B OS=Mus musculus OX=10090 GN=Ube2b PE=1 SV=1	1.0
sp|A8ANV7|PIMT_CITK8 Protein-L-isoaspartate O-methyltransferase OS=Citrobacter koseri (strain ATCC BAA-895 / CDC 4225-83 / SGSC4696) OX=290338 GN=pcm PE=3 SV=1	sp|B7LWJ2|PIMT_ESCF3 Protein-L-isoaspartate O-methyltransferase OS=Escherichia fergusonii (strain ATCC 35469 / DSM 13698 / CCUG 18766 / IAM 14443 / JCM 21226 / LMG 7866 / NBRC 102419 / NCTC 12128 / CDC 0568-73) OX=585054 GN=pcm PE=3 SV=1	0.9745550878552823
sp|B1XBG3|CAIB_ECODH L-carnitine CoA-transferase OS=Escherichia coli (strain K12 / DH10B) OX=316385 GN=caiB PE=3 SV=1	sp|B6HYY9|CAIB_ECOSE L-carnitine CoA-transferase OS=Escherichia coli (strain SE11) OX=409438 GN=caiB PE=3 SV=1	0.9966353573223208
sp|A6LX30|PXPA_CLOB8 5-oxoprolinase subunit A OS=Clostridium beijerinckii (strain ATCC 51743 / NCIMB 8052) OX=290402 GN=pxpA PE=3 SV=1	sp|A8FA07|PXPA_BACP2 5-oxoprolinase subunit A OS=Bacillus pumilus (strain SAFR-032) OX=315750 GN=pxpA PE=3 SV=1	0.6899130847323477
sp|Q96ES6|MFSD3_HUMAN Major facilitator superfamily domain-containing protein 3 OS=Homo sapiens OX=9606 GN=MFSD3 PE=1 SV=1	sp|Q96ES6|MFSD3_HUMAN Major facilitator superfamily domain-containing protein 3 OS=Homo sapiens OX=9606 GN=MFSD3 PE=1 SV=1	1.0
sp|Q2T199|APT_BURTA Adenine phosphoribosyltransferase OS=Burkholderia thailandensis (strain ATCC 700388 / DSM 13276 / CCUG 48851 / CIP 106301 / E264) OX=271848 GN=apt PE=3 SV=1	sp|B1JHN6|APT_YERPY Adenine phosphoribosyltransferase OS=Yersinia pseudotuberculosis serotype O:3 (strain YPIII) OX=502800 GN=apt PE=3 SV=1	0.6555737818180337
sp|P9WIR7|APA_MYCTU Alanine and proline-rich secreted protein Apa OS=Mycobacterium tuberculosis (strain ATCC 25618 / H37Rv) OX=83332 GN=apa PE=1 SV=1	sp|Q7W9B4|ISPH_BORPA 4-hydroxy-3-methylbut-2-enyl diphosphate reductase OS=Bordetella parapertussis (strain 12822 / ATCC BAA-587 / NCTC 13253) OX=257311 GN=ispH PE=3 SV=1	0.20203629042057464
sp|A6UPK3|CBID_METVS Cobalt-precorrin-5B C(1)-methyltransferase OS=Methanococcus vannielii (strain ATCC 35089 / DSM 1224 / JCM 13029 / OCM 148 / SB) OX=406327 GN=cbiD PE=3 SV=1	sp|Q60342|CBID_METJA Cobalt-precorrin-5B C(1)-methyltransferase OS=Methanocaldococcus jannaschii (strain ATCC 43067 / DSM 2661 / JAL-1 / JCM 10045 / NBRC 100440) OX=243232 GN=cbiD PE=3 SV=1	0.5144218839931304
sp|A9X1C8|EXT1_PAPAN Exostosin-1 OS=Papio anubis OX=9555 GN=EXT1 PE=3 SV=1	sp|O43909|EXTL3_HUMAN Exostosin-like 3 OS=Homo sapiens OX=9606 GN=EXTL3 PE=1 SV=1	0.14980257606542716
sp|P0AEM1|FKBX_ECOL6 FKBP-type 16 kDa peptidyl-prolyl cis-trans isomerase OS=Escherichia coli O6:H1 (strain CFT073 / ATCC 700928 / UPEC) OX=199310 GN=fkpB PE=3 SV=2	sp|P22661|HOXH_RHOOP NAD-reducing hydrogenase HoxS subunit beta (Fragment) OS=Rhodococcus opacus OX=37919 GN=hoxH PE=1 SV=1	0.2672274004925697
sp|A1WVG0|NUSB_HALHL Transcription antitermination protein NusB OS=Halorhodospira halophila (strain DSM 244 / SL1) OX=349124 GN=nusB PE=3 SV=1	sp|A1K279|NUSB_AZOSB Transcription antitermination protein NusB OS=Azoarcus sp. (strain BH72) OX=418699 GN=nusB PE=3 SV=1	0.4736444507926826
sp|Q1GEY7|QUEC_RUEST 7-cyano-7-deazaguanine synthase OS=Ruegeria sp. (strain TM1040) OX=292414 GN=queC PE=3 SV=1	sp|Q92UN9|QUEC_RHIME 7-cyano-7-deazaguanine synthase OS=Rhizobium meliloti (strain 1021) OX=266834 GN=queC PE=3 SV=1	0.769186810952017
sp|O97952|ANDR_MACFA Androgen receptor OS=Macaca fascicularis OX=9541 GN=AR PE=2 SV=1	sp|O97952|ANDR_MACFA Androgen receptor OS=Macaca fascicularis OX=9541 GN=AR PE=2 SV=1	1.0
sp|A8G8W5|PRIB_SERP5 Primosomal replication protein N OS=Serratia proteamaculans (strain 568) OX=399741 GN=priB PE=3 SV=1	sp|Q1CEH1|PRIB_YERPN Primosomal replication protein N OS=Yersinia pestis bv. Antiqua (strain Nepal516) OX=377628 GN=priB PE=3 SV=1	0.862084443967883
sp|B5ZYT2|EFG_RHILW Elongation factor G OS=Rhizobium leguminosarum bv. trifolii (strain WSM2304) OX=395492 GN=fusA PE=3 SV=1	sp|Q2K9L9|EFG_RHIEC Elongation factor G OS=Rhizobium etli (strain ATCC 51251 / DSM 11541 / JCM 21823 / NBRC 15573 / CFN 42) OX=347834 GN=fusA PE=3 SV=1	0.9689034309081574
sp|Q09MF3|RR12_CITSI Small ribosomal subunit protein uS12cz/uS12cy OS=Citrus sinensis OX=2711 GN=rps12-A PE=3 SV=1	sp|A6MM15|RR12_BUXMI Small ribosomal subunit protein uS12cz/uS12cy OS=Buxus microphylla OX=153571 GN=rps12-A PE=3 SV=1	0.987181421350907
sp|Q5L5L9|RL19_CHLAB Large ribosomal subunit protein bL19 OS=Chlamydia abortus (strain DSM 27085 / S26/3) OX=218497 GN=rplS PE=3 SV=1	sp|Q0AWV9|RL19_SYNWW Large ribosomal subunit protein bL19 OS=Syntrophomonas wolfei subsp. wolfei (strain DSM 2245B / Goettingen) OX=335541 GN=rplS PE=3 SV=1	0.5487446229779741
sp|B7GMW3|RNPA_ANOFW Ribonuclease P protein component OS=Anoxybacillus flavithermus (strain DSM 21510 / WK1) OX=491915 GN=rnpA PE=3 SV=1	sp|C1ER80|RNPA_BACC3 Ribonuclease P protein component OS=Bacillus cereus (strain 03BB102) OX=572264 GN=rnpA PE=3 SV=1	0.6921507587196282
sp|Q9UW20|PIK1_CANAL Phosphatidylinositol 4-kinase PIK1alpha OS=Candida albicans (strain SC5314 / ATCC MYA-2876) OX=237561 GN=PIKALPHA PE=3 SV=1	sp|P39104|PIK1_YEAST Phosphatidylinositol 4-kinase PIK1 OS=Saccharomyces cerevisiae (strain ATCC 204508 / S288c) OX=559292 GN=PIK1 PE=1 SV=1	0.13005484836817108
sp|Q7WYG5|METK_LEGJE S-adenosylmethionine synthase OS=Legionella jeonii OX=2728 GN=metK PE=3 SV=1	sp|Q7WYG5|METK_LEGJE S-adenosylmethionine synthase OS=Legionella jeonii OX=2728 GN=metK PE=3 SV=1	1.0
sp|Q497Q6|F228B_MOUSE Protein FAM228B OS=Mus musculus OX=10090 GN=Fam228b PE=2 SV=1	sp|P0C875|F228B_HUMAN Protein FAM228B OS=Homo sapiens OX=9606 GN=FAM228B PE=1 SV=2	0.5954823393656533
sp|B7HQD2|MTNN_BACC7 5'-methylthioadenosine/S-adenosylhomocysteine nucleosidase OS=Bacillus cereus (strain AH187) OX=405534 GN=mtnN PE=3 SV=1	sp|Q634H0|MTNN_BACCZ 5'-methylthioadenosine/S-adenosylhomocysteine nucleosidase OS=Bacillus cereus (strain ZK / E33L) OX=288681 GN=mtnN PE=3 SV=1	1.0
sp|Q8NM23|PURT_CORGL Formate-dependent phosphoribosylglycinamide formyltransferase OS=Corynebacterium glutamicum (strain ATCC 13032 / DSM 20300 / JCM 1318 / BCRC 11384 / CCUG 27702 / LMG 3730 / NBRC 12168 / NCIMB 10025 / NRRL B-2784 / 534) OX=196627 GN=purT PE=3 SV=2	sp|Q0BD59|PURT_BURCM Formate-dependent phosphoribosylglycinamide formyltransferase OS=Burkholderia ambifaria (strain ATCC BAA-244 / DSM 16087 / CCUG 44356 / LMG 19182 / AMMD) OX=339670 GN=purT PE=3 SV=1	0.6955438253273579
sp|P30969|GNRHR_RAT Gonadotropin-releasing hormone receptor OS=Rattus norvegicus OX=10116 GN=Gnrhr PE=2 SV=2	sp|P80657|RBS_PHYPA Ribulose bisphosphate carboxylase small subunit, chloroplastic (Fragment) OS=Physcomitrium patens OX=3218 GN=RBCS PE=1 SV=1	0.20273535465518353
sp|Q9JKK1|STX6_MOUSE Syntaxin-6 OS=Mus musculus OX=10090 GN=Stx6 PE=1 SV=1	sp|C4LL12|RS8_CORK4 Small ribosomal subunit protein uS8 OS=Corynebacterium kroppenstedtii (strain DSM 44385 / JCM 11950 / CIP 105744 / CCUG 35717) OX=645127 GN=rpsH PE=3 SV=1	0.25025239014034123
sp|A7ZZD1|TREA_ECOHS Periplasmic trehalase OS=Escherichia coli O9:H4 (strain HS) OX=331112 GN=treA PE=3 SV=1	sp|B6I9Q8|TREA_ECOSE Periplasmic trehalase OS=Escherichia coli (strain SE11) OX=409438 GN=treA PE=3 SV=1	0.99735110933587
sp|A7GTP5|ACCA_BACCN Acetyl-coenzyme A carboxylase carboxyl transferase subunit alpha OS=Bacillus cytotoxicus (strain DSM 22905 / CIP 110041 / 391-98 / NVH 391-98) OX=315749 GN=accA PE=3 SV=1	sp|Q81KY9|ACCA_BACAN Acetyl-coenzyme A carboxylase carboxyl transferase subunit alpha OS=Bacillus anthracis OX=1392 GN=accA PE=3 SV=1	0.9530689871505642
sp|A9KX16|RSMG_SHEB9 Ribosomal RNA small subunit methyltransferase G OS=Shewanella baltica (strain OS195) OX=399599 GN=rsmG PE=3 SV=1	sp|B1KQ44|RSMG_SHEWM Ribosomal RNA small subunit methyltransferase G OS=Shewanella woodyi (strain ATCC 51908 / MS32) OX=392500 GN=rsmG PE=3 SV=1	0.8078603579968302
sp|Q46IJ5|SSRP_PROMT SsrA-binding protein OS=Prochlorococcus marinus (strain NATL2A) OX=59920 GN=smpB PE=3 SV=1	sp|Q8YM70|SSRP_NOSS1 SsrA-binding protein OS=Nostoc sp. (strain PCC 7120 / SAG 25.82 / UTEX 2576) OX=103690 GN=smpB PE=3 SV=1	0.5727685412952922
sp|Q8NJM2|DBP10_ASPFU ATP-dependent RNA helicase dbp10 OS=Aspergillus fumigatus (strain ATCC MYA-4609 / CBS 101355 / FGSC A1100 / Af293) OX=330879 GN=dbp10 PE=3 SV=1	sp|A1DNG2|DBP10_NEOFI ATP-dependent RNA helicase dbp10 OS=Neosartorya fischeri (strain ATCC 1020 / DSM 3700 / CBS 544.65 / FGSC A1164 / JCM 1740 / NRRL 181 / WB 181) OX=331117 GN=dbp10 PE=3 SV=1	0.512997454884443
sp|Q6D4W1|RNFD_PECAS Ion-translocating oxidoreductase complex subunit D OS=Pectobacterium atrosepticum (strain SCRI 1043 / ATCC BAA-672) OX=218491 GN=rnfD PE=3 SV=1	sp|C6DH14|RNFD_PECCP Ion-translocating oxidoreductase complex subunit D OS=Pectobacterium carotovorum subsp. carotovorum (strain PC1) OX=561230 GN=rnfD PE=3 SV=1	0.9476063921676838
sp|Q83D86|MGSA_COXBU Methylglyoxal synthase OS=Coxiella burnetii (strain RSA 493 / Nine Mile phase I) OX=227377 GN=mgsA PE=3 SV=1	sp|Q65UB4|MGSA_MANSM Methylglyoxal synthase OS=Mannheimia succiniciproducens (strain KCTC 0769BP / MBEL55E) OX=221988 GN=mgsA PE=3 SV=2	0.632989562397407
sp|B0RIN6|ILVC_CLASE Ketol-acid reductoisomerase (NADP(+)) OS=Clavibacter sepedonicus OX=31964 GN=ilvC PE=3 SV=1	sp|Q4JUN9|ILVC_CORJK Ketol-acid reductoisomerase (NADP(+)) OS=Corynebacterium jeikeium (strain K411) OX=306537 GN=ilvC PE=3 SV=1	0.6679893104024577
sp|Q8CGK7|GNAL_MOUSE Guanine nucleotide-binding protein G(olf) subunit alpha OS=Mus musculus OX=10090 GN=Gnal PE=1 SV=1	sp|P63094|GNAS2_MOUSE Guanine nucleotide-binding protein G(s) subunit alpha isoforms short OS=Mus musculus OX=10090 GN=Gnas PE=1 SV=1	0.6350192595023155
sp|B8E2S7|DAPB_DICTD 4-hydroxy-tetrahydrodipicolinate reductase OS=Dictyoglomus turgidum (strain DSM 6724 / Z-1310) OX=515635 GN=dapB PE=3 SV=1	sp|B1VXZ4|DAPB_STRGG 4-hydroxy-tetrahydrodipicolinate reductase OS=Streptomyces griseus subsp. griseus (strain JCM 4626 / CBS 651.72 / NBRC 13350 / KCC S-0626 / ISP 5235) OX=455632 GN=dapB PE=3 SV=1	0.360184351401266
sp|P53573|ETFA_BRADU Electron transfer flavoprotein subunit alpha OS=Bradyrhizobium diazoefficiens (strain JCM 10833 / BCRC 13528 / IAM 13628 / NBRC 14792 / USDA 110) OX=224911 GN=etfA PE=3 SV=2	sp|O33096|ETFA_MYCLE Electron transfer flavoprotein subunit alpha OS=Mycobacterium leprae (strain TN) OX=272631 GN=etfA PE=3 SV=1	0.26913087903572286
sp|Q9BIB4|YMYD_CAEEL Transcription initiation factor IIA small chain homolog OS=Caenorhabditis elegans OX=6239 GN=B0336.13 PE=3 SV=1	sp|B7Q1Q9|T2AG_IXOSC Transcription initiation factor IIA subunit 2 OS=Ixodes scapularis OX=6945 GN=IscW_ISCW010050 PE=3 SV=1	0.3774937407334772
sp|Q64548|RTN1_RAT Reticulon-1 OS=Rattus norvegicus OX=10116 GN=Rtn1 PE=1 SV=1	sp|Q64548|RTN1_RAT Reticulon-1 OS=Rattus norvegicus OX=10116 GN=Rtn1 PE=1 SV=1	1.0
sp|W6QIM3|IFGE_PENRF Chanoclavine-I dehydrogenase ifgE OS=Penicillium roqueforti (strain FM164) OX=1365484 GN=ifgE PE=1 SV=1	sp|W6QIM3|IFGE_PENRF Chanoclavine-I dehydrogenase ifgE OS=Penicillium roqueforti (strain FM164) OX=1365484 GN=ifgE PE=1 SV=1	1.0
sp|P56079|CDS_DROME Phosphatidate cytidylyltransferase, photoreceptor-specific OS=Drosophila melanogaster OX=7227 GN=Cds PE=1 SV=2	sp|P56079|CDS_DROME Phosphatidate cytidylyltransferase, photoreceptor-specific OS=Drosophila melanogaster OX=7227 GN=Cds PE=1 SV=2	1.0
sp|Q2QLG6|CAV1_CALJA Caveolin-1 OS=Callithrix jacchus OX=9483 GN=CAV1 PE=3 SV=1	sp|Q2QLC1|CAV1_PLEMO Caveolin-1 OS=Plecturocebus moloch OX=9523 GN=CAV1 PE=3 SV=1	1.0
sp|A6LPX4|LEUC_CLOB8 3-isopropylmalate dehydratase large subunit OS=Clostridium beijerinckii (strain ATCC 51743 / NCIMB 8052) OX=290402 GN=leuC PE=3 SV=1	sp|Q2LWJ2|LEUC_SYNAS 3-isopropylmalate dehydratase large subunit OS=Syntrophus aciditrophicus (strain SB) OX=56780 GN=leuC PE=3 SV=1	0.7282914100614033
sp|P62521|CCDC8_RAT Coiled-coil domain-containing protein 8 OS=Rattus norvegicus OX=10116 GN=Ccdc8 PE=1 SV=1	sp|D3YZV8|CCDC8_MOUSE Coiled-coil domain-containing protein 8 homolog OS=Mus musculus OX=10090 GN=Ccdc8 PE=1 SV=2	0.20821622444803956
sp|Q7T199|KCA10_CHICK Potassium voltage-gated channel subfamily A member 10 OS=Gallus gallus OX=9031 GN=KCNA10 PE=2 SV=1	sp|Q16322|KCA10_HUMAN Potassium voltage-gated channel subfamily A member 10 OS=Homo sapiens OX=9606 GN=KCNA10 PE=1 SV=2	0.6731885159888495
sp|Q8R844|TDXH2_CALS4 Peroxiredoxin 2 OS=Caldanaerobacter subterraneus subsp. tengcongensis (strain DSM 15242 / JCM 11007 / NBRC 100824 / MB4) OX=273068 GN=TTE2186 PE=3 SV=1	sp|P95784|ATP6_STRMU ATP synthase subunit a OS=Streptococcus mutans serotype c (strain ATCC 700610 / UA159) OX=210007 GN=atpB PE=3 SV=1	0.2656746511852092
sp|Q9Y5U4|INSI2_HUMAN Insulin-induced gene 2 protein OS=Homo sapiens OX=9606 GN=INSIG2 PE=1 SV=2	sp|Q91WG1|INSI2_MOUSE Insulin-induced gene 2 protein OS=Mus musculus OX=10090 GN=Insig2 PE=1 SV=1	0.9673631140007203
sp|Q9SSA8|RA212_ARATH Ethylene-responsive transcription factor RAP2-12 OS=Arabidopsis thaliana OX=3702 GN=RAP2-12 PE=1 SV=1	sp|Q71P68|PSBN_HYPCP Protein PsbN OS=Hypnum cupressiforme OX=53011 GN=psbN PE=3 SV=2	0.19981372497268785
sp|B1V8K7|GLAA_PETGR Alpha-1,3-galactosidase A OS=Peterkaempfera griseoplana OX=66896 GN=glaA PE=1 SV=1	sp|Q111E0|RECA_TRIEI Protein RecA OS=Trichodesmium erythraeum (strain IMS101) OX=203124 GN=recA PE=3 SV=1	0.15551761071099365
sp|P50227|ST1A1_BOVIN Sulfotransferase 1A1 OS=Bos taurus OX=9913 GN=SULT1A1 PE=1 SV=2	sp|P52846|ST1A1_MACFA Sulfotransferase 1A1 OS=Macaca fascicularis OX=9541 GN=SULT1A1 PE=2 SV=1	0.8750823768393815
sp|Q8ZJF6|AROB_YERPE 3-dehydroquinate synthase OS=Yersinia pestis OX=632 GN=aroB PE=3 SV=1	sp|B1JIQ4|AROB_YERPY 3-dehydroquinate synthase OS=Yersinia pseudotuberculosis serotype O:3 (strain YPIII) OX=502800 GN=aroB PE=3 SV=1	1.0
sp|A4TH05|RS14_YERPP Small ribosomal subunit protein uS14 OS=Yersinia pestis (strain Pestoides F) OX=386656 GN=rpsN PE=3 SV=1	sp|A7FNM1|RS14_YERP3 Small ribosomal subunit protein uS14 OS=Yersinia pseudotuberculosis serotype O:1b (strain IP 31758) OX=349747 GN=rpsN PE=3 SV=1	1.0
sp|Q5X9H5|MUTL_STRP6 DNA mismatch repair protein MutL OS=Streptococcus pyogenes serotype M6 (strain ATCC BAA-946 / MGAS10394) OX=286636 GN=mutL PE=3 SV=2	sp|Q1JJH1|MUTL_STRPC DNA mismatch repair protein MutL OS=Streptococcus pyogenes serotype M12 (strain MGAS9429) OX=370551 GN=mutL PE=3 SV=1	0.9883052623872272
sp|Q6FVE6|PFA4_CANGA Palmitoyltransferase PFA4 OS=Candida glabrata (strain ATCC 2001 / BCRC 20586 / JCM 3761 / NBRC 0622 / NRRL Y-65 / CBS 138) OX=284593 GN=PFA4 PE=3 SV=1	sp|Q9SYC8|LPAT3_ARATH 1-acyl-sn-glycerol-3-phosphate acyltransferase 3 OS=Arabidopsis thaliana OX=3702 GN=LPAT3 PE=2 SV=1	0.19163697918408706
sp|Q2J352|COAE_RHOP2 Dephospho-CoA kinase OS=Rhodopseudomonas palustris (strain HaA2) OX=316058 GN=coaE PE=3 SV=1	sp|Q89WN9|COAE_BRADU Dephospho-CoA kinase OS=Bradyrhizobium diazoefficiens (strain JCM 10833 / BCRC 13528 / IAM 13628 / NBRC 14792 / USDA 110) OX=224911 GN=coaE PE=3 SV=1	0.7970515377714626
sp|A5U6P9|XERC_MYCTA Tyrosine recombinase XerC OS=Mycobacterium tuberculosis (strain ATCC 25177 / H37Ra) OX=419947 GN=xerC PE=3 SV=1	sp|Q1BAI5|XERC_MYCSS Tyrosine recombinase XerC OS=Mycobacterium sp. (strain MCS) OX=164756 GN=xerC PE=3 SV=1	0.6558590374690643
sp|Q8RL85|LEU1_GEOSE 2-isopropylmalate synthase OS=Geobacillus stearothermophilus OX=1422 GN=leuA PE=3 SV=1	sp|Q8RL85|LEU1_GEOSE 2-isopropylmalate synthase OS=Geobacillus stearothermophilus OX=1422 GN=leuA PE=3 SV=1	1.0
sp|Q2Y9Y7|BIOH_NITMU Pimeloyl-[acyl-carrier protein] methyl ester esterase OS=Nitrosospira multiformis (strain ATCC 25196 / NCIMB 11849 / C 71) OX=323848 GN=bioH PE=3 SV=1	sp|Q87TC2|BIOH_VIBPA Pimeloyl-[acyl-carrier protein] methyl ester esterase OS=Vibrio parahaemolyticus serotype O3:K6 (strain RIMD 2210633) OX=223926 GN=bioH PE=3 SV=2	0.22916202630679144
sp|Q93XQ4|PMT2_NICAT Putrescine N-methyltransferase 2 OS=Nicotiana attenuata OX=49451 GN=PMT2 PE=2 SV=1	sp|Q9ZUB3|SPDS1_ARATH Spermidine synthase 1 OS=Arabidopsis thaliana OX=3702 GN=SPDSYN1 PE=1 SV=1	0.5303173538280799
sp|Q96QV6|H2A1A_HUMAN Histone H2A type 1-A OS=Homo sapiens OX=9606 GN=H2AC1 PE=1 SV=3	sp|Q6GSS7|H2A2A_MOUSE Histone H2A type 2-A OS=Mus musculus OX=10090 GN=Hist2h2aa1 PE=1 SV=3	0.8678779172237372
sp|O26687|SYM_METTH Methionine--tRNA ligase OS=Methanothermobacter thermautotrophicus (strain ATCC 29096 / DSM 1053 / JCM 10044 / NBRC 100330 / Delta H) OX=187420 GN=metG PE=3 SV=1	sp|Q2NI31|SYM_METST Methionine--tRNA ligase OS=Methanosphaera stadtmanae (strain ATCC 43021 / DSM 3091 / JCM 11832 / MCB-3) OX=339860 GN=metG PE=3 SV=1	0.2986405670479085
sp|A5UG05|RIMM_HAEIG Ribosome maturation factor RimM OS=Haemophilus influenzae (strain PittGG) OX=374931 GN=rimM PE=3 SV=1	sp|A6VLP7|RIMM_ACTSZ Ribosome maturation factor RimM OS=Actinobacillus succinogenes (strain ATCC 55618 / DSM 22257 / CCUG 43843 / 130Z) OX=339671 GN=rimM PE=3 SV=1	0.9415865736921317
sp|Q5R598|REEP4_PONAB Receptor expression-enhancing protein 4 OS=Pongo abelii OX=9601 GN=REEP4 PE=2 SV=1	sp|Q2KI30|REEP2_BOVIN Receptor expression-enhancing protein 2 OS=Bos taurus OX=9913 GN=REEP2 PE=2 SV=1	0.4780849960442326
sp|P60531|TSKS_RAT Testis-specific serine kinase substrate OS=Rattus norvegicus OX=10116 GN=Tsks PE=1 SV=1	sp|O54887|TSKS_MOUSE Testis-specific serine kinase substrate OS=Mus musculus OX=10090 GN=Tsks PE=1 SV=4	0.9614481835308955
sp|Q7Z402|TMC7_HUMAN Transmembrane channel-like protein 7 OS=Homo sapiens OX=9606 GN=TMC7 PE=1 SV=1	sp|Q7Z402|TMC7_HUMAN Transmembrane channel-like protein 7 OS=Homo sapiens OX=9606 GN=TMC7 PE=1 SV=1	1.0
sp|Q0RF16|KDPA_FRAAA Potassium-transporting ATPase potassium-binding subunit OS=Frankia alni (strain DSM 45986 / CECT 9034 / ACN14a) OX=326424 GN=kdpA PE=3 SV=1	sp|A3Q5E2|KDPA_MYCSJ Potassium-transporting ATPase potassium-binding subunit OS=Mycobacterium sp. (strain JLS) OX=164757 GN=kdpA PE=3 SV=1	0.45146010451071944
sp|A1ABP0|PSRP_ECOK1 Phosphoenolpyruvate synthase regulatory protein OS=Escherichia coli O1:K1 / APEC OX=405955 GN=ppsR PE=3 SV=1	sp|Q1RB92|PSRP_ECOUT Phosphoenolpyruvate synthase regulatory protein OS=Escherichia coli (strain UTI89 / UPEC) OX=364106 GN=ppsR PE=3 SV=1	1.0
sp|C1F3C4|DXS_ACIC5 1-deoxy-D-xylulose-5-phosphate synthase OS=Acidobacterium capsulatum (strain ATCC 51196 / DSM 11244 / BCRC 80197 / JCM 7670 / NBRC 15755 / NCIMB 13165 / 161) OX=240015 GN=dxs PE=3 SV=1	sp|A1W4U9|DXS_ACISJ 1-deoxy-D-xylulose-5-phosphate synthase OS=Acidovorax sp. (strain JS42) OX=232721 GN=dxs PE=3 SV=1	0.38969008573756464
sp|Q6GDP4|ROCA_STAAR 1-pyrroline-5-carboxylate dehydrogenase OS=Staphylococcus aureus (strain MRSA252) OX=282458 GN=rocA PE=3 SV=1	sp|Q2FDV3|ROCA_STAA3 1-pyrroline-5-carboxylate dehydrogenase OS=Staphylococcus aureus (strain USA300) OX=367830 GN=rocA PE=3 SV=1	1.0
sp|G3XSI2|AUNA_ASPNA Aurasperone B biosynthesis cluster protein A OS=Aspergillus niger (strain ATCC 1015 / CBS 113.46 / FGSC A1144 / LSHB Ac4 / NCTC 3858a / NRRL 328 / USDA 3528.7) OX=380704 GN=aunA PE=3 SV=1	sp|A1JTI8|CITD_YERE8 Citrate lyase acyl carrier protein OS=Yersinia enterocolitica serotype O:8 / biotype 1B (strain NCTC 13174 / 8081) OX=393305 GN=citD PE=3 SV=1	0.21815672536921302
sp|B4TXA5|AROE_SALSV Shikimate dehydrogenase (NADP(+)) OS=Salmonella schwarzengrund (strain CVM19633) OX=439843 GN=aroE PE=3 SV=1	sp|Q0TCI0|AROE_ECOL5 Shikimate dehydrogenase (NADP(+)) OS=Escherichia coli O6:K15:H31 (strain 536 / UPEC) OX=362663 GN=aroE PE=3 SV=1	0.8471097945375047
sp|Q7N352|RL25_PHOLL Large ribosomal subunit protein bL25 OS=Photorhabdus laumondii subsp. laumondii (strain DSM 15139 / CIP 105565 / TT01) OX=243265 GN=rplY PE=3 SV=1	sp|B2VII8|RL25_ERWT9 Large ribosomal subunit protein bL25 OS=Erwinia tasmaniensis (strain DSM 17950 / CFBP 7177 / CIP 109463 / NCPPB 4357 / Et1/99) OX=465817 GN=rplY PE=3 SV=1	0.824611617173382
sp|W7N466|FDB3_GIBM7 Transcription factor FBD3 OS=Gibberella moniliformis (strain M3125 / FGSC 7600) OX=334819 GN=FDB3 PE=2 SV=1	sp|A2I469|RL38_MACHI Large ribosomal subunit protein eL38 OS=Maconellicoccus hirsutus OX=177089 GN=RpL38 PE=3 SV=1	0.1456139920491567
sp|B4SAM9|SAT_PELPB Sulfate adenylyltransferase OS=Pelodictyon phaeoclathratiforme (strain DSM 5477 / BU-1) OX=324925 GN=sat PE=3 SV=1	sp|A5WEH0|SAT_PSYWF Sulfate adenylyltransferase OS=Psychrobacter sp. (strain PRwf-1) OX=349106 GN=sat PE=3 SV=1	0.5286470304165188
sp|J4VV61|GT1_BEAB2 UDP-glucosyltransferase 1 OS=Beauveria bassiana (strain ARSEF 2860) OX=655819 GN=BBA_08686 PE=2 SV=1	sp|Q9XIQ5|U7B10_ARATH UDP-glycosyltransferase 79B10 OS=Arabidopsis thaliana OX=3702 GN=UGT79B10 PE=2 SV=1	0.19763389472653292
sp|A8ID55|BLD10_CHLRE Basal body protein 10 OS=Chlamydomonas reinhardtii OX=3055 GN=BLD10 PE=1 SV=1	sp|Q6HDI8|AROE_BACHK Shikimate dehydrogenase (NADP(+)) OS=Bacillus thuringiensis subsp. konkukian (strain 97-27) OX=281309 GN=aroE PE=3 SV=1	0.11071391816591544
sp|P0AA29|THIO_SALTI Thioredoxin 1 OS=Salmonella typhi OX=90370 GN=trxA PE=1 SV=2	sp|P0AA27|THIO_ECO57 Thioredoxin 1 OS=Escherichia coli O157:H7 OX=83334 GN=trxA PE=1 SV=2	1.0
sp|Q8RWC5|FLA16_ARATH Fasciclin-like arabinogalactan protein 16 OS=Arabidopsis thaliana OX=3702 GN=FLA16 PE=2 SV=1	sp|O48551|PSA6_SOYBN Proteasome subunit alpha type-6 OS=Glycine max OX=3847 GN=PAA1 PE=2 SV=2	0.1809595250618983
sp|Q14JZ0|TPIS_FRAT1 Triosephosphate isomerase OS=Francisella tularensis subsp. tularensis (strain FSC 198) OX=393115 GN=tpiA PE=3 SV=1	sp|Q1QSY6|TPIS_CHRSD Triosephosphate isomerase OS=Chromohalobacter salexigens (strain ATCC BAA-138 / DSM 3043 / CIP 106854 / NCIMB 13768 / 1H11) OX=290398 GN=tpiA PE=3 SV=1	0.5133542091437473
sp|A7ZUD2|CDH_ECO24 CDP-diacylglycerol pyrophosphatase OS=Escherichia coli O139:H28 (strain E24377A / ETEC) OX=331111 GN=cdh PE=3 SV=1	sp|A7ZUD2|CDH_ECO24 CDP-diacylglycerol pyrophosphatase OS=Escherichia coli O139:H28 (strain E24377A / ETEC) OX=331111 GN=cdh PE=3 SV=1	1.0
sp|A0AK94|LEUC_LISW6 3-isopropylmalate dehydratase large subunit OS=Listeria welshimeri serovar 6b (strain ATCC 35897 / DSM 20650 / CCUG 15529 / CIP 8149 / NCTC 11857 / SLCC 5334 / V8) OX=386043 GN=leuC PE=3 SV=1	sp|A0AK94|LEUC_LISW6 3-isopropylmalate dehydratase large subunit OS=Listeria welshimeri serovar 6b (strain ATCC 35897 / DSM 20650 / CCUG 15529 / CIP 8149 / NCTC 11857 / SLCC 5334 / V8) OX=386043 GN=leuC PE=3 SV=1	1.0
sp|Q9ZV08|GNAT4_ARATH GCN5-related N-acetyltransferase 4, chloroplastic OS=Arabidopsis thaliana OX=3702 GN=GNAT4 PE=1 SV=1	sp|Q9ZV08|GNAT4_ARATH GCN5-related N-acetyltransferase 4, chloroplastic OS=Arabidopsis thaliana OX=3702 GN=GNAT4 PE=1 SV=1	1.0
